Position,Rating,Review Title,Role,Pros,Cons
369,4,"Employees matter, management cares, still a growing company",Anonymous employee,"The land of opportunity with endless possibilities. Not a perfect company, but we've grown a lot over the years and now are moving towards a new era of positive changes and a well-defined direction. The vision is clear, management wants to make it a better place for employees. We have countless meetings run by upper management to force us to give them feedback. Yes, we are all locked in a room together to collaborate...feels like electing a pope where no one is getting out until we are done...only we have food, snacks, and breaks. They listen and make changes to improve our overall culture. Culture is pretty laid back. Facility is amazing. Benefits are improving. Great holiday parties.","No defined career paths for employees. How can I get promoted if there is no standard guideline? How can I take myself to the next level? Communication could be improved from manager level to employee. There are management-specific meetings, but seems as though information stops at the manager level. How can I help you if I don't have the full picture? Documenting our goals is always an afterthought. Telecommuting isn't really promoted. Not enough family events and no daycare."
370,3,Fun For a While,Anonymous employee,"- Super fun and great people - Strong team dynamic on some teams - Easy to get the ear of upper mgmt if you know the right people - Lets of challenges and areas to lead improvements across all functions - Relatively easy to look like a strong employee if you have basic stills (communication, documentation, follow-thru)","- Management is scattered and unclear on strategy and that shows at all levels (a lot of ""do it because I said so"" type management) - Company is complacient on current strong product lead creating lots of egos leading vs trying to look forward - Poor employee development, lots of people that have been there for years in the same type of role who are good but cannot be great because there is no movement or real direction on how to improve - Always saying to think ""global"" but no actual global execution or support from mgmt"
371,1,Intuit has ruined Sony,Anonymous employee,Working for sony network entertainment is very rewarding because you get to work on something that is in the face of millions of users. This is extremely large scale. It's exciting and fun to know that you are part of something big.,The new untouchable upper management that was pulled in from intuit is ruining this company by striking fear in everyone and firing good employees. Mediocre VPs with no experience bring in directors of engineering who have never been an engineer just does not make any sense. It's hard to respect directors who acts with a brute force without even understanding the perspective of others. They completely threw away everything we have been working so hard on and come into the company demanding to rebuild everything for the sake of rebuilding. The moral is really low in the company and it kills any innovation because we have no freedom to innovate.
372,3,"They care for customers, not so sure about employees",Technical project manager,"Hands on with gaming consoles and games. The company strives hard to keep customers/gamers happy by keeping content fresh and introducing new technologies. Lots of talented and passionate employees work here. The ""cool"" factor about working at a gaming company, your family & friends flock towards you at parties/gatherings.","The gaming community as a whole are very spoiled customers compared to other industries. They get to whine and complain about the smallest details about games and consoles that will cause the Nintendos/Microsofts/Sonys to have knee-jerking reactions to their strategies and decisions. This often comes at a price of causing stress to employees in forms of constant team restructuring, projects being in constant flux, management changing directions, layoffs and OFFICE POLITICS. If you can't handle being thrown under the bus or not being sure whether people are talking $h!t behind your back, don't work here or at any gaming company!"
373,1,Not Bitter Just SAD,Character artist,Worked on many KICKASS games with some awesome people.,"Worked for the company as a ""Contract"" employee for 8 years. To get around the laws of California they would ""lay me off"" for a few months then have me back so they didn't have to pay for my benefits. I loved what I did but management refused to give reviews, pay raises or hire me on full-time even though the position was available and I had received a Masters Degree in the same field. That all isn't the worst. The worst was after 8 years they ""ghosted"" me. Basically, they told me they were going to lay me off for a few months, then when I contacted them repeatedly for when my start date was...NO RESPONSE. I thought these people were my friends ...The biggest slap in the face was my job was posted on their website 3 weeks later. ....Thanks Sony San Diego!"
374,5,"Great gamer culture, great growth opportunities, some shortcomings",Product manager,"- Great educational, medical and transportation perks - Great bonuses and employee discounts on PlayStation and Sony products - lots of opportunities to travel overseas, particularly to Tokyo or London - Supportive leadership that Lets employees explore different Career paths and grow - Passionate coworkers who love gaming and are really into what they are doing - a low-conflict environment with a Strong drive for consensus and respect - Agile development practices with continuous improvement, hackathons and quick adjustments based on lessons learned - work from home opportunities in The U.S. and management focused on Results, Not attendance - a quirky and creative environment typical of The gaming industry - a company that encourages playing games at work - a very approachable CEO and most other top leaders - lots of women in leadership positions, even in Japan (mostly up to Sr. Director level but also some VPs)","- Incompetence is sometimes tolerated indefinitely, true to the life-employment model of Japan - Managers frequently lack the most fundamental people management skills and don't know how to motivate their employees - Lack of open conflict leads to a lot of back-channeling, politics and having to read between the lines - In the Tokyo office, expectations about work hours are insane and no one can work from home, which leads to female workers still largely being forced to choose between having career success and being single, or having a decent but unimpressive job at PlayStation and having a family - The super-Agile style of the San Fransisco office frequently clashes with the Waterfall thinking of Tokyo - As of 2018, analytics is still not a big part of decision making and a lot of product managers are weak - Employee performance management is unpredictable and convoluted. There are no company-wide OKRs and it's hard to understand how performance goals are measured"
375,2,"Sometimes fun, but often a let down",Anonymous employee,"So many of the people are incredible and the products are really fun. The games, the people, the culture of play could make it into a terrific place to work... But","There's massive chaos right now on what the company will become. They've had three new CEOs in 18 months, and their Network still lags behind the competition. Overall, the company is in major upheaval, which is surprising and often creates some major confusion about where one fits. Companywide functions are really underpowered -- some are barely even paid attention to while others dominate. So often, stuff happens with in one function in a complete silo, and then it breaks across other groups."
376,3,Volatile environment with no respect for employees,Anonymous employee,"There are some very talented people at SNEI in San Diego who work hard to achieve results, believing in doing the right things. The business has challenging goals to achieve and they will likely succeed with proper attention to delivering experiences to beat their competitors. Salary is good and the onsite gym is great. Culture there is fast-paced but allows for company outings to get to know your colleague and just to have a good time.","The business is volatile and can be crushed easily by their competitors if not done correctly. The turn-over is high and I've seen people let go immediately with no notice and there's a hush-hush attitude about it. Work environment is fierce so you have to be careful whom you may disappoint or else management will easily let you go, I've seen it with my own eyes."
377,5,Wonderful place to work!,Anonymous employee,"SNEI is a great place to work. This division of Sony only started about 6-8 years ago, as opposed to SCEA which has been around a while. Anyway, because its new, you feel like it almost has a start-up feel to it even though its such a well-established company! People really care about your growth here, they want to hear your opinion and your input, and they are very smart people! They're also super down to earth. The quality of work is amazing you get to work on an entertainment platform - games, movies and music!! I definitely give it the highest rating!","There are always some negatives to a job (certain employees, processes' etc) but its all what you make of it. Its like taking the bad with the good, but generally I see everything is pretty great at this place"
378,4,Good place to work for but effective management is a bit lacking.,Anonymous employee,Working at PlayStation is pretty fun if you love video games. The work environment is laid-back in general. The company is not a stickler for when you get in or leave. People are pretty understanding if you need to leave early for personal reasons or need to take a few days off for vacation. The employees are nice and it's relatively easy to become close to the people you work with.,"In the time I've worked here, I've come to realize the company is not as organized as you hope it would be for such a big corporation. Communication is lacking and sometimes things aren't done effectively or on time because of this. I think this partly has to do with how many people are involved in one project. With so many people, there is a tendency for projects to lose focus because there is not one person or group taking ownership."
379,3,Lots of weekends!,Merchandising field representative,Anything that PlayStation makes you get for free! Very generous PTO policy. Company is closed between Christmas and New Years with pay. Cool products and great brand recognition. Merchandisers get to make their own schedule with some parameters.,Being a merchandiser used to be a fun job. You got to meet different people and every day was different. But now all we do is go to the same store every weekend and demo VR. My work life balance has gotten really bad. I work almost every weekend and I often work 8 days in a row or more because I am still expected to perform my normal duties along with the weekend work. I am getting burnt out.
380,1,"Good People, Terrible Management",Senior software engineer,- large-scale - really Great engineers - Weekly lunches - benefits,"- 25% of the advertised compensation was a yearly bonus. Don't be fooled. Depending on when you join it might be 1.5 years before you get it. - Also, if they decide you are not worth what they're paying, which base salary is already below average, they will string you along until just before bonus time and cut you with 0 days warning. - Also, and this is a first that I've ever heard of in the Bay Area, no severance whatsoever. Yes, none at all. Nothing. No 2 weeks pay, no warning, no here's rent money until you find something. Just, don't show up any more. - They work you like a start up but you have none of the creative input. - Management is incompetent and out of touch with the technologies and decisions. - Politics. A friend who spearheaded a major initiative to change the entire server deployment process, working day and night, did not get a promotion while the manager is taking all the credit."
381,2,"Used to be great, recently lost its way",Anonymous employee,"- The individual contributors are very good. They're smart, driven, and very easy-going. - The benefits and perks as part of the Sony family are great: Good health plans, huge discounts on sony products, free playstation games, etc. - Workers are encouraged to develop their skills by learning new tech and attending training and seminars. - Work / life balance is great. People are given flexibility as long as the work gets done. - Office culture is relaxed and casual.","- with one or two exceptions, middle management is Toxic, tribal, and self-serving. - Zero opportunity to move up in your Career - Pending merger with SIE is causing dread and rumors about job security, made worse by silence from Upper management. - office space is outdated and falling apart, management has no plans to do anything about it."
382,3,Used to be a good place to work.,Anonymous employee,"The people were good. Discount on Sony products. Occasional in-house happy hours. Ability to watch some movies pre-release. Without question, the company brand name was good.","Once the Sr Mgmt crew (all formerly from another well known company in the area) came in and took over things started to go downhill. The company used to support Scrum but started doing things that seemed to be very contrary to agile practices. The attitudes of the new ""leadership"" was very negative, at least towards existing SNE employees. They were better with the ones they brought in from their former company. This caused many to feel they were being adversarial."
383,1,Awful company with fake people,Operations analyst,Free games and that's it,"Everything, payment , management, work hours , yoh"
384,2,Independent place that lacks direction and vision,Anonymous employee,"Informal atmosphere, good benefits, good time off. People can be very friendly.","The company feels like it lacks direction. A great deal of bureaucracy strangles innovation. Company feels like it's loosing it's competitive edge in the age of online gaming. HR is a nightmare. No solid plan for advancement within the company. Company doesn't mentor. HR has no strategy in place to retain top talent. Pay is low. Talent is mediocre. Japanese style hierarchy and decision making structure is out of place in Silicon Valley. The company ""events"" have become an embarrassing joke (karaoke in the parking lot anyone?)."
385,1,Intuit Mafia is ruining SNEI,Anonymous employee,Sony has a good work/life balance. SNEI revenue is growing rapidly and should continue to do so for at least the next year or two. Most people working there who are not former Intuit employees are good people to work with.,"Over the last year a new executive in the San Diego office has been aggressively clearing out people and installing yes-people from Intuit. We're not just talking about clearing out people that perhaps needed to go, but clearing out anyone that asks questions. The entire atmosphere of innovation, collaboration, and desire to produce the best result for the company has been replaced with one that punishes innovation and enforces conformity and acquiescence over all else."
386,1,It's all a ploy for cheap labor,Intern,"Having PlayStation on your resume is cool, telling your friends about it is cool, and the free swag is cool.","Don't expect to be valued as an actual part of your team. I was often left with no projects and when I asked for more, my peers and manager would tell me they were busy and I couldn't help them. There was a lot of politics even from an intern level. Although the dress code is laid back, the culture in general is not. I saw many team members staying late to meet deadlines and could feel the stress in the air. Sony will tear you apart and does not value their employees. It also sucks because they offer a lot of contract roles and you never know what your status may be with that. Very little information was offered to me in my performance review and I was never told how I could improve or what could have gone better."
387,2,Toxic,Anonymous employee,"Working on PlayStation and being a part of the video game industry. The PlayStation ecosystem is always on the cutting edge, and the time I spent there was during the PS4 launch so it was doubly exciting. The passion and enthusiasm many of the employees have for what they're doing is unrivaled. It wasn't uncommon to find people who just loved what they did.","Management was terrible. The value of human resources was lost on many people, and the people in positions of power were too interested in saving face to make sure their workforce was being managed and treated properly. There were countless situations where management was aware of a terrible work environment but actively avoided the subject and did nothing to rectify the situation."
388,3,Good place to learn,Senior engineer,"Good place to learn, gain experience and make connections. The London office is in central London with a lot to do nearby, great restaurants and culture. You work for Playstation which people are generally know and interested about. You work with game studios and technologies that will be used in future games and media. The culture is inclusive, you will find many different looking faces here. There was no crunch and a pretty good work-life balance in my team.","Lot of company politics to deal with, secrecy and distrust between different teams. Lots of emails on the start of day and multiple meetings per day that are unproductive. Collaboration between different regions is sparse. Some internal systems that are being used are ancient. Salary is a joke, people working at Playstation are often living in house shares in London, and you will not be able to save up on an Engineer salary."
389,3,average company,Business operations manager,"I worked as Department Operations Manager. Average employee experience compared to other companies in the Bay area. HR people are nice and receptive but a mouthpiece for the Sr Directors and VPs- forget employee advocation! Nice HQ, good holiday parties. Good learning module on employee central. Legal people are also very collaborative and friendly. Good Pay and bonus.","Facilities workers are efficient but the managers are totally narcissistic. R&D department is run like a concentration camp. Have no idea how to efficiently manage people. Slave drivers rather than inspiring team to engage. Very Very hierarchical, political charged culture, employees with Japanese background are favored and not reprimanded- high level of Nepotism. Not at all entrepreneurial. Employees not promoted based on merit, but based on their national origin (or who they know)."
390,4,SCEA sucks,Anonymous employee,"Benefits, culture, free food and drinks, parties, my management is awesome (YMMV), opportunity to explore different things, some work from home, flexible hours, tons of paid time off.","Perks like holiday parties are declining, upper management cuts money on necessary small return items and spends liberally on unnecessary stuff; high turnover and onboarding of every single application anyone wants creates a lot of work and hemorrhages money, but they cut spending on office cleaning and other minor expenses. Merging of SCEA and SNEI has been appallingly inept and there has been little or no engagement of stakeholders for anything."
391,2,"Formerly a good workplace, now going down hill.",Anonymous employee,Discounts on the limited selection of first party games.,Pay isn't great when they're trying to compete and act like a tech company. Benefits are mediocre and don't compare to other companies in the area. Big distinction in work place benefits compared to their first party studios. No employee development or major support towards paying for education. Educational support is on the low end.
392,5,Best Place I've Worked to Date,Information security engineer,Sony Interactive Entertainment evolves and changes to improve not only innovations to become more profitable but I really feel like they care about their employees. They continue to improve processes and policies if they aren't successful. Fantastic benefits package Emphasis on work/life balance Great coworkers - lots to learn from others There is a sense of community to solving problems (lots of support from others) Wonderful company goals that are actually strived for,"At least in my department, meaningful self improvement training budget has been cut which is a bummer. As in many places, opportunities for advancement are limited but there is a balance to be met here between becoming too management heavy but I think SIE does a fair job of figuring that out. I really respect the executive team and believe they have a good vision for the company, however there are some middle managers that tend to play politics instead of focusing on improvements."
393,2,"Company with good perks, but the system is suffering from a lot of growing pains",Brand manager,Good perks if you are a gamer. Benefits package is alright. The company is an industry giant and has market leadership.,"The system is so entrenched in a kind of boys club attitude. Time spent in the company, deference to leaders, and maintaining the status quo are the main concerns. You will be thrown out if you do not move with the grain or if you question how things are done or try to think outside of the box. The way they treat contractors is embarrassing. Pay is much lower than a good majority of the Bay Area companies. The benefits package is alright, but there are no stock options. The company is still smarting from globalization and if you are on a global team, you can pretty much kiss your work-life balance goodbye."
394,1,Don't apply if you want to progress,Functional tester,Games given out to staff on launch date for free. Occasional raffle for freebies. Cake table at end of the month.,"Unless you're in a certain circle of people don't expect to get an interview for a promotion, even if you've worked hard at the company for years. People are promoted based on favouritism and not experience/skills which leads to some staff lacking in skills to manage a team. Certain seniors abuse their position and treat testers like children, some going so far as to bully staff and get them into trouble. If a person is favourited they can get away with pretty much anything, even if a higher up witnesses them doing something bad. Test floor gets super toxic whenever a new position gets announced and some staff don't hold back on saying what they think of others capabilities."
395,2,Sr. Designer,Senior designer,"Very nice campus. Good benefits. Nice cafeteria. Some fun perks like monthly $10 game vouchers and discounts on hardware. A week and a half shut down during the holidays which is good for full-time employees, but not contractors (which don't get paid).",Some inexperienced employees waste multiple team's time and energy by being reactive and flip-flop in their decision making. This wastes time and energy for multiple teams and is frustrating to be effected by inexperienced employees with too much power. Pay is below market rate and hours are inflexible (9am-6pm).
396,4,Cut your teeth,Cinematic animator,"Projects, people and location. You will be able to apply to a huge selection of studios if you spend a few years here.","Contract oriented, static pay, no upward mobility or broad knowledge learned. If you want to focus on the core of being a cinematic animator, you do that here. Get in some beach time while you are at it because you may not want to wait five years to move up the ladder or get a raise. It is a well known fact in the studio that you have to leave and come back to get a meaningful raise, and you might find yourself priced out of the studio with how competitive the rest of the industry is now."
397,2,Not a place for ambitious people,Engineer,"* Amazing product (PlayStation!!!) * If lucky, you get to work on very visible parts of the products * Get to try pretty cool games or tech (Morpheus) * Nice campus","* Work/life balance can be poor - a few people do all the work - others do the minimum * Don't even think about being a contractor there: you will be treated like garbage * All key decisions are made in Japan, no involvement of US people in the decisions * Impossible to have a relevant role or any ambition - dead end for your career * Low compensation compared to the rest of Silicon Valley * Management aware of all these problems - not doing anything about it."
398,5,work hard....have fun,Anonymous employee,"The culture here is pioneering. Not quite a startup anymore, rather an organization striving to grow. Not for everyone. People who excel here are ingenious, see around corners, have an “anything is possible” outlook, live for the mission, are cool to work with, possess tons of resilience and are really top in their craft. Personally, have a great boss, great team and super cool work to do. It's not by any stretch an easy job - but it's one where I make a difference every day and have fun doing it.",The org is behind in building out infrastructure and systems. Organizations have a lot of autonomy - but it also results in silos.
399,2,"Major Issues - Too Many 'Lifers', and Not Open to Change!",Anonymous employee,Decent benefits package Ok work/life balance Relative Flexible Schedule,- Employees that have been there a long time no longer have to prove themselves. Too many old fat cats. - New employees are held to a different standard. - There are double standard and unfairness in how employees are treated. Too many old 'cliques'. Somewhat like high school. - Communication from ANY management level is sorely missing. - Change is at a snail's pace.
