Position,Rating,Review Title,Role,Pros,Cons
429,2,Lost Its Way,Anonymous employee,"SCEA has great work/life balance. In the past, it provided great advancement opportunities. There were many social opportunities to interact with employees in other departments. People were very friendly. Paid time off at the holidays was awesome.","Management has been trying to improve the company for the past 3-4 years, but each change continues to diminish morale. New management does not value the contributions of the employees who built the company. ""Lifers"" has become a negative term instead of one of respect. Old management is trying too hard to please new management, and the ""Sony Way"" has been lost."
430,2,Fun Industry but Very Poor Executive Management,Senior manager,"Great product, friendly co-workers, fun industry. I loved work here at PlayStation, mostly because of the industry. I learned a lot of what NOT to do!","Executive Mgmt is clueless. PS Move, 3D and PS Vita are all failures. PS Mobile will be the next failure. I don't have a lot of confidence that Orbis will sell well as I don't see it selling to the casual audience. They simply don't need it. The company is quickly losing support of their 3rd Party Publishers."
431,5,Best place to play (work) in Madison!!!,Anonymous employee,"- Great pay and benefits! - Tons of holidays - Management is a joy to work for - People, people, people!! The team is great, full of smart dedicated people! - Good discounts on Sony things! - The PlayStation is booming!! - Occasional travel to San Diego and San Francisco. Seriously, if you want to have fun doing what you do, what could be more fun than PlayStation, especially in Madison? There are only a handful of companies here that can compete with the Sony for compensation and what would you rather work on? Medical data? Insurance? Construction? No thanks, I'd rather work for PlayStation :)","- It is a large corporation still, so there are The occasional annoyances that way. but The Madison office is Small and mostly insulated from them"
432,3,Okay place to work. Beware of the yellow badge.,Anonymous employee,"There are some great coworkers here who are very hard working and are passionate about their work. Also, SCEA produces some great products that you can be proud to say you help develop/market.","Being a very Japan-centric company, there are certain rules, boundaries and restrictions that keep this place from moving forward and keeping up with the competition. Also, this company liberally uses contractors as expendable workers who they run through regularly with no sense of appreciation."
433,2,"Nice People, Poor Pay",Senior sound designer,"Good people, occasional paid trips if you're in the right department, good benefits such as pension and travel allowance, the prestige of being able to say you work for Playstation","Poor pay, too many middle managers who contribute very little, poor facilities and tools to do the job, people held back in their careers and not given the chance to grow. I was also aware of female members of staff being paid less than their male counterparts, however I'm not sure how widespread across the company this was."
434,1,Indie studios have more structure,Wws qa tester,Relaxed Environment. Some minor events to promote LGTBQA+ events.,"Can be too relaxed. A lot of staff sit with social media up, or sit on their phones No progression - A lot of 2+ year staff with no promotion or raise in place. Paid at same level as new staff. Multiple teams with no say on who or what you work on. Erratic changes to staffing and assigned projects. Several staff have missed out on being credited in games due to changes near the end of a project, damaging their CV and future. Base QA Staff are treated differently. Hired through recruitment agency Yoh! Base QA Staff are exempt from special offers to Sony staff, insurances, special events"
435,2,"Very political, cliquey",Anonymous employee,"Nice neighborhood, free coffee. A couple of fun perks, such as free Sony Music CDs and a $10 voucher to spend monthly at the Playstation Network store online.","Low pay, long hours. If you're one of the ""in crowd""--meaning you had a prior relationship with management--you get treated with a lot of respect, and are made to feel like part of the team. If not, not so much. Senior management all men with no kids--not much consideration for > 20-somethings with families. Not real big on self-criticism/project postmortems, which helps explain the ongoing poor performance (technical, not financial) of the Playstation Store."
436,3,Was great at first but went downhill in my time - maybe getting better though,Anonymous employee,excellent vacation and perks. had some of my best times there and can be extremely fun & satisfying place to work if you are under the right management.,Started off great under excellent manager but my negative experience was due to changing over to different manager who was a bully so this may not be your experience.
437,4,A very rewarding place to work,Anonymous employee,"Company values and goals have significantly changed during my tenure. Originally it was the Wild West, with corporate politics and petty small-office backstabbing leading the fray. Significant changes in middle management and new policies from upper management have changed the culture to the point where loyalty is desired and rewarded, rather than keeping ""King of the Hill"" silo-based ethics.","Despite the positive changes in culture, opportunities for advancement are still very limited and rare, primarily restricted to management-tier jobs. There are plenty of lateral-movement job opportunities though, as Sony expands its cloud services with Gaikai."
438,4,"PlayStation QA, Dream Job",Qa lead & infrastructure support,"Tested pre-release video games - a dream job for any Gamer. Very tight-knit community amongst QA staff. Great new campus with modern amenities (cafe, arcade, gym). Commuter benefits. Frequent game launch events on campus.","Cliquey. Siloing of divisions can make you feel like a stranger. Not all divisions appreciate the same perks (flex schedule, WFH, standard business hours). Individual contributions can be difficult to map to high-level Company Vision and Direction."
439,2,Cheap games but you pay for it in other ways,Senior manager commerce operations,"Cheap games, Fantastic relocation package, good pay, great benefits","Leadership, work hours are unrealistic, expectations are not communicated well, the clique from Intuit is well known and highly resented, no work-life balance, working from home is taboo"
440,2,Poor Place to Work,Anonymous employee,Very good benefits. Talented co-workers. Long Christmas break.,"Ineffective leadership and poor employee appreciation. Goals are not clearly defined, and you are reviewed upon incoherent goals created a month prior. Confusing structure, long hours, and poor treatment of employees. Very little opportunities to move upward and no tools to help you grow. Talented people do not stay very long. Elitist and very boy's club. No female VPs ever. Brilliant women have either been laid off, left, or are not promoted. VPs hire their buddies or ...groomsmen. Does not pay competitively, HR will low-ball you so they can get their bonus. HR covers management's rears. And a handful of them act inappropriately."
441,1,Toxic Culture,Software engineering leader,"Good pay and benefits, nice perks, decent office, Starbucks, cafeteria.","Toxic culture all around. Ex-Intuit leadership uses bullying, intimidation, and public humiliation to strongarm people into their ways. Japanese culture is typical hierarchical, micromanagement, imitation of your superiors, rule following, and don't color outside the lines to command and control the staff. The result is there is no leadership at Sony because the focus is all on managing down to control the Engineers and tell them how to do their job. To add, since the Japanese culture is robotic and lacks human empathy, they do not understand or recognize the criticality of soft skills and human interaction in business leadership, so tend to make poor business decisions and hiring decisions."
442,5,Fun and relaxed culture,Paralegal,"Working with really smart and creative people. Independent thinkers, even in the legal department people are fun, open-minded and know how to have fun while working hard and knowing their stuff. Great time off after Christmas (don't have to take your vacation hours), Pay is decent but not astounding, bonuses are good for those who do their work and do it well.","Can get competitive or weird among certain individuals who are very unique and maybe a bit off. They are a bit behind the times in tech resources for a tech company. Legal department employees use a somewhat annoying database, and the email system was backwards when I worked there. I hear they've since upgraded it."
443,2,Perfect if you don't ever want to advance,Anonymous employee,"Exciting industry, cutting edge enterainment products. Flexibility to plan your schedule from Jan-October. Get to try the products first, huge discounts on PlayStation products.","Disorganized R.A.D. department that doesn't give you the tools to effectively do your job and manage your territory. Absolutely no opportunity for advancement, as they fill 100% of the open management positions from outside the organization (within the past 3 years anyway). Unattainable goals, too much work in too short of deadline to get completed."
444,3,Used to be a good place to work....,Anonymous employee,Good career starting company. Competitive pay and bonus. Great brand name to be associated with. Not a lot of stress at work and balance of work/life. The CEO of Sony has turned the failing company around. For now.,"Merger with the Network team from San Diego polarized the Playstation group. Team and group politics are rampant. People in power promoting their cronies is open and unabashed. Management from Japan seems to have no pulse of local technology developments (iPhone, Alexa, ,,,,). Or about the people who work in the US. Decisions from Japan on local processes and tools makes things worse."
445,5,Senior Programmer,Senior software engineer,Working on the highest quality games was exciting. You get to work with some of the smartest game makers in the industry on cutting edge hardware and software. Working for PlayStation gives you instant credibility with just about everyone because the brand is so loved.,"Working with a lot of personalities can be difficult, and as a game company there is always a lot of time pressure."
446,5,Want to work for a real company?,Anonymous employee,"SNEI has great benefits: medical, dental, 401k, stock options, tuition reimbursement, paid vacation, paid holidays, Friday bagel/donuts, milestone parties, training, just to name a few. The environment is very casual, jeans are normal everyday attire for most. There is an onsite cafeteria, gym (membership not included, but it is fairly inexpensive), bank and cafe. Employees are expected to work hard but are also rewarded accordingly. SNEI employees are surrounded by knowledgeable and intelligent colleagues. SNEI works with leading technology, evolving as technology changes. Low employee turn-over and the company is doing exceptionally well.","Like most technology industries, supporting a 24/7 network means being on call from time to time."
447,4,Great experience and made life long friends along the way,Senior creative,The people I worked with. Be prepared to work hard but have fun at the same time. I worked at Playstation for about 5 years and I grew professionally and personally at this company. The pay was OK but there are plenty of benefits when working for a company like this. They have a great campus and the location is set not to far from the San Francisco airport.,There are some office politics that go on here. And I did see and experience some shady moves happen. But in a company or organization you will see it.
448,4,Good and Bad ... mostly good.,Regional sales manager,"Great products, great employee interaction, respect of consumers. In a very competitive market, SCEA stood apart by not bowing to the ""easy route"". Management was willing to stick to plan even when it appeared things were not going well. Most times, in the end, management was right and it was good to be part of it.","Political system for promotions or job assignments. Mostly based on who you knew or were friendly with. Mid-level management would attack peers considered rivals for time, attention, or job opportunities."
449,2,Not living up to its potential,Senior software engineer,"The Sony PlayStation network is huge network, presenting many challenging engineering problems. Coworkers are a great bunch of people who, while very diverse, get along well and are respectful of each other. There's always a fun social event to participate in. Benefits are pretty good (I don't know what other companies are offering but I've been happy with the benefits).","Over the past three years, the San Diego office has seen a new senior VP, two additional VPs, multiple directors and senior architects and managers all come in from the same company (Intuit). At the same time, the existing senior Sony people have been squeezed out, quietly encouraged to leave, or just fired. No one from the original Sony Network San Diego in any position of responsibility and no one from the original Sony days has been promoted. There have been many new senior level positions filled, but none from within the company. Some have been given new titles, but no real promotions. Existing engineers have not been allowed to participate in the technical direction of the network. They are seen as hindrances and not as contributors. A closed environment of fear and distrust has been created where people cannot question direction or voice honest opinions. It's a dreary engineering environment lacking in excitement or peer collaboration."
450,4,"Great employees, leadership lacks",Anonymous employee,The people you work with are amazing. Arguably the best part about working here. The benefits are also top notch if you're a full time employee.,"Leadership lacks diversity. Heads are all older white males with the exception of 1 new executive hire. There's little opportunities for women here due to the ratio differences. During fiscal budget planning or quarterly budget planning, employees are on their toes because not only are there budget cuts, but that usually means the cuts will be coming from headcount. Expect surprise lay offs."
451,3,"Great benefits, lots of politics",Project manager,The company offers great benefits and is flexible when it comes to maintaining a good work-life balance. Employees are friendly and open-minded and there is a solid sense of community.,"Lots of office politics. Very ageist organization. Promotions go to friends or connections. Lower-level employees do the bulk of the work while senior leadership take credit and keep getting promoted. Not much room for innovation and independent thought. A great place for followers, not so much for people who want to effect real change."
452,3,MBA summer intern,Intern,Company has a great environment and work atmosphere ; People all around are friendly. Playstation has an amazing campus in San Mateo and throughout the summer there were a few events that were extremely fun.,"The company has a lot of people who have been there for a long period of time , these individuals are occupying management positions that could be filled up with fresh blood , there aren't many opportunities to grow within the company. Compensation is very low , specially considering the location of Playstation's headquarter."
453,2,Entry-level treated badly,Online community,-Great canteen -Decent Pay -relaxed working environment,-Overuse of contractors with refusal to grant stable permanent positions with inferred benefits - Drink/sleep with the boss to get anywhere - it's a bit of an old boys club. - Expected to come into the office on Xmas day - Terrible work-life balance of hours between 8AM - 11PM for frontline contractors - Management are old-school and refuse to keep up with the times - Huge lack of communication between various areas of the business. - Complaints about sexual harassment are mostly ignored by HR/ Management until volume of complaints is too high
454,4,Excellent workplace,Application developer,"Company culture is diversified and excellent with people from all parts of the world Environment and colleagues are great with relationship with business areas when defining projects Challenging projects due to lack of integration between the platforms used on the business applications Good benefits, from subsidized canteen and bar to discount on products, plus an excellent holiday allowance Senior Management is usually accessible and line managers are flexible with estimates and open for ideas on how to better solve a problem","Low salary Long time for plans to kick-off No chance of career progression, even you are good and hard worker Lack of commitment from some colleagues and areas Counterproductive process to get small things done All this cause a high turnover which impacts further the plans made"
455,4,Decent Place to Work!,Anonymous employee,"good work-life balance, great bonuses at year end, best PTO policy & the number of days I have ever come across, fun people to work!","only get promoted or moved to a new role if an employee leaves the position; depending on the manager you work for, they truly are interested in your growth and knowledge enhancement"
456,5,"Good company, better people",Production,Not a lot of top-down management pressure A lot of flexibility in how you get your job done Good pay Great benefits Generally a good team culture,"Big company, so politics abound Hard to ferret out what's really going on unless you're part of the ""favored"" group of individuals that knows all the secrets"
457,3,Mixed bag,Anonymous employee,"- many opportunities to learn new things, trainings, conferences - Diverse technology also encourages people to learn and master new skills - Good benefits - Talented people - Friendly atmosphere","- Company carries the baggage from 10-15 years ago: departmental silos, IT vs Dev, slow to react to new technologies - sub-par management on all levels: micromanagement, lack of transparency, say one thing-do something else, favoritism, personal preferences - talented employees were forced out because they didn't submit to their poorly performing superiors"
458,5,One of the best game studios to work for in Los Angeles,Senior environment artist,AAA Quality Projects Competitive Benefits Unique Work Environment Encourages Creativity More Control of your tasks and creations,"Not much room for personal growth, the studio is very large . It is not clear how certain individuals are promoted when comparing the amount of contributions other developers bring the studio. Not much of an effort has been made to solidify art direction. Lack of direction is also the result of allowing too much free will."
459,2,"Good company philosophy -- poorly vetted, hostile management",Anonymous employee,"Many good people in the organization from diverse backgrounds; on-premises health club and cafe; hot food is available almost all day. Easy parking, safe work location.","Where do I begin? The hostility in this place is rampant. It exists at all levels, including the administration. Legacy employees live in silos and treat new employees with utter disdain. On the platform engineering side, the formerly-Intuit management solution to growth is to stack layers and layers of management between themselves and the worker bees. This is offset somewhat by the Japanese philosophy of owning the outcome - they force managers to rotate on-call; eating their own dog-food, so to speak. Instead of studying and refining current tools and processes, they create a new management position to address a shortcoming. Right now I have four managers between myself and a director. We have three engineers and one manager in my group. That's one manager for three people! Forget about fair consideration for a job. Some managers post jobs only as a necessary requirement, but could care less about outside candidates. I've seen highly qualified candidates completely overlooked because the hiring manager wanted to give that job to an old colleague or friend. If outside applicants had any idea, they probably wouldn't apply. Why should they? They'll likely get other offers before Sony gives them a chance. I can go on and on, -- the micro-managing, the meaningless gestures of generosity, the lack of coordination and standardization, etc., but I won't. But let me say this... if you apply at the Sony Taleo web site, and someday you get an email from Sony, be wary. The only reason why they would seem eager to hire anyone is to fill in a position that is badly understaffed. You'll get quickly hired thrown right into the fire, without even a semblance of proper guidance. Then what? Before you know it, you're stuck in a lousy job. And don't let them offer you a bonus with your salary negotiations. It's totally bogus. Unless you work 12 hour days and weekends and nights, you won't see squat for a bonus. I paid in blood, sweat and tears for this company, working weekends and nights and early mornings, only to be ""rewarded"" with a bonus that was a fraction of what was due. Sony pays out very little in bonuses even though the platform is making almost $8 billion this year alone! Over 1000 people work their butts off at SNEI to guarantee this 24/7/365 revenue stream for Sony, and for them to turn around and pay out a tiny fraction as a bonus is beyond insulting. It's a slap in the face. Don't waste your time with Sony Network Entertainment. Between the hostility, layers and layers of inept management, long, long hours and sheisty bonus payouts, there's very little reason to want to join this company. Which is too bad because I find the Japanese principals I work with --nationals from Japan-- to be wonderful people with honest and kind intentions. They're polite, generous, understanding, forgiving to a reasonable degree, and eager to come up with cool stuff, like the Playstation Network. It's the middle and upper management from the US and elsewhere that are ruining things for SNEI. This could be a much strong and more profitable company if it weren't for these management problems."
460,4,Senior Program Manager,Senior program manager,"The people, the technology, the environment, the cool factor of working at PlayStation, the fact that you work at a company that has customers who are not just customers they are fans! The executives are actually really cool people who do not sit on a pedestal. In fact, all of the management team and all of the individual contributors are genuinely sincere people who really care about the product and that's an amazing thing. The VPs and SVPs are incredible, approachable, knowledgeable, thoughtful and caring about the fans first. They practice what they preach for sure when it comes to being the best place to play (and work!) It's really an incredible place to work for so many reasons. The benefits and the perks and everything, I won't even describe because they're what you would expect… Simply amazing. It is definitely the coolest place I've ever worked and that's a high bar. There are so many great things to say about this company that I would probably spend the next hour writing them but I don't know if anyone would ever read all the amazing things I could say.","No clue how they ever delivered any product in the 20+ years before I got there. The process, or processes, are a total mess. No one business unit has any of the same or even similar processes - even with in the same business unit. Remember now, I am giving a four star review here because it is truly a pleasure to work there. It would be a 5 Star review....But, there are some serious deficiencies in how the company operates that have been solved at software and hardware companies years and years ago. Generally speaking, there aren't many egos to deal with but, there are a few and most of those come from the newer individual contributors, not the management team. Thankfully for the customers, a.k.a. fans, they make billions of dollars and can afford to make billions of mistakes and still deliver consistently. It's a crazy mystery I'll never understand but it does actually work I guess. The fact that no one knows who does what is the biggest challenge. Figuring out what people do in the company, because no one actually seems to know and I'm talking about people who have been there for years and years is amazingly difficult. AMAZINGLY DIFFICULT."
461,2,Changes are not for the better,Senior project manager,- Competitive and plentiful benefits - Up to 3.5% matching for 401K - Easy going immediate coworkers - Flexibility of schedule from immediate management - Frequently Giveaways and Campus events - Free Game Content for select teams - Easy Parking - Lots of love for brand culture,- lots of critical scrutiny from Upper non-US based management - lower than average wages for many positions - many slacker teams - Not much visibility with The frequent reorganizations until after The fact - poor Career progression paths
