Position,Rating,Review Title,Role,Pros,Cons
237,1,Work life imbalance. Leadership lacks compassion,Senior manager,- free games every week - competitive salary - Homeworking - growth and progression opportunities for lower levels due to high churn - Results/shareholder driven business,"- Global company means early starts and late finishes - Office presence isn't mandatory but has led to absence of a friendly, caring culture - 'Take a time out during the day', but leadership hold UK meetings at lunch. - 'Take a time out during the day', when my kids and partner, friends are at school or working - Cronyism - Pockets of aggressive, borderline bullying, culture and regime. Patronising senior directors"
238,5,Great,Software developer,Great Place to work at,None great place to work
239,2,Horrible communication with employees,Business analyst,great people to work with,horrible leadership and communication with employees
240,3,Pros & cons,Senior director business management,A highly inclusive workplace / aspirational brand,"Slow, lack of agility and self-centered"
241,4,Great company,Hr assistant,"Good benefits, teamwork is valued",lack of communication from top management
242,5,Love It,Financial analyst,Best teamwork environment for those who love it,None of it I can think of
243,4,"Great Brand, Great Job, Great Company",Anonymous employee,"I got talk about PS games everyday. I got to show customers the best games and hardware in the industry. There was great benefits Medical,Dental, 401k and free games.",Management was always changing and new guidelines for projects were constantly changing.
244,4,Slow and old fashioned but making much needed changes,Sales planning,"Great Office, benefits and nice people, great CEO","Old fashioned ways of working, IT infrastructure, slow decision-making, stuck in the past"
245,4,"Good Company, Better Coworkers!",Project manager,Talented industry professionals Supportive coworkers,Work/Life balance Sometimes too little direction from management
246,4,Amazing company to work for,Anonymous employee,Great working environment and great people,"slow career progression
lack of processes"
247,3,Engineer,Software engineer,Fun place to work because you deal with PlayStation,Very uncompetitive pay because they use their name to pay you. Probably about 25% - 50% underpaid compared to other companies. Lot of people come and go because of this. Those who stay are ones that don't mind getting paid low for the time being. This is good for a first job or a stepping stone
248,5,Company,Accountant,Good company to work for,Nothing at this point yet
249,4,Sony,Software developer in test,"Nice colleagues, office environment, free lunch, enjoyable tasks","Can get boring sometimes, disclosure takes 2 weeks."
250,5,great place to work,Consultant/senior pm,working with some extremely creative and hardworking people,not a lot of advancement opportunities
251,1,If you're brown or black avoid playstation,Technology,"Free food, nice offices, free games, a lot of benefits",Internally Playstation has a huge cultural problem with black and brown people. casual racism is the norm. Good diversity on everything else however as long as its white or asian.
252,5,Great place to work,Art director,"Creative, interesting space with lovely people","Big company, the more senior you go the more challenges you'll get with politics."
253,3,Mixed,Data scientist,Good salary and work colleagues.,Job tasks very different from the job description.
254,5,Best Company to Work,Software engineer,"Work Life Balence, Good Bonus Structure, PlayStation Free Game and good leadership team.","Not a Competitive Pay, Not a lot of cons"
255,5,Points of extreme and valid interest,Junior consultant,A contemporary company ro work at.,No cons to comment on.
256,4,Decent,Quality assurance analyst,Perks like food and drinks,Could be paid significantly more
257,2,Short Term thinking leads to long term problem,Anonymous employee,Relaxed atmosphere with some genuinely well-meaning people.,The company wasn't incentivized to react to the competition for the long-term and people that don't understand the market were essentially incharge of direction.
258,3,Very managed and very hard to progress,Anonymous employee,Nice people that are passionate about their work.,Very top down management with very little room to progress. Almost no transparency or big picture insight for non management workers. Very personally competitive and guarded culture. Low pay.
259,4,Busy but friendly colleagues,Receptionist,"People are friendly, the office is really cool. Creative environment",It can be busy at times.
260,4,A+,Software engineer,Great Place to work you will love it,Not many cons for this job
261,5,A good place to work,Marketing specialist,"Good work-life balance
Interesting projects
Flexible work
International team","Low salary
Flat structure
Career possibilities should be developed"
262,5,Best place to work and grow,Data engineer,- Supportive and collaborative culture - Friendly and smart people - Good salary and Career prosects - free canteen,- gym options/discounts Can be improved
263,5,xxx,Information security manager,"I do not have any issues, all is good.",There are not any issues
264,4,Loved the experience,Software engineer,Good excellent good experience good environment,Could be better but good
265,4,Great Experience,Sound designer,"Good working environment, benefits and training",Usual corporate issues associated with a large corporation
266,3,Limited Opportunities,Senior game designer,Reasonable wages and benefits Nice working enviroment,Limited opportunity for promotion Senior management are random and directionless
267,4,Good workload-to-compensation ratio.,Senior software engineer,"Good benefits and work-life balance, essentially remote, don't overwork their employees.",Lots of corporate overhead and boilerplate to get simple things done
268,5,Analyze QA about the game,Qa analyst,"Professional work environment
Occasional Holidays",Competitiveness is more than other companies i have worked
269,4,"Overall, solid company",Certified medical assistant,They try go give good customer service to their consumers.,"Don't really have any, they are a good company overall."
270,3,Overall decent,Anonymous employee,"Game launches, food, benefits, offices and so much more! The office was a really great place to work!",Upper management in the legal department.
271,4,Way too much bureaucracy and process,Senior software engineer,"Rancho Bernardo office is beautiful. Employee cafeteria is on the 10th floor with a view to the ocean. Level 6, the Sony gym, is 100% subsidized and right on top of the parking garage, it's beautiful. In general the engineers are good to work with. Will pay for some people to go to offsite training, but the paperwork to get approval is outrageous. Fantastic relocation package. Decent profit sharing. (annual bonus)","Management won't allow upgrades of the technology even when it would benefit the bottom line. Up until this year they used C++98, a 21 year old compiler. (They moved to C++11) Claims to move projects to JAVA or at least micro services but never actually starts those projects. Sony back end services moved to AWS but won't allow teams to use the AWS suites without major reviews by ""architecture team."" Claims to have a sandbox area for engineers to experiment in, but it's so locked down nothing actually can run there. Low level management has no clue how to run a team. Mid level management spends 110% of their time in meetings. Upper management puts out great ""Dream of a new company"" speeches but doesn't move the company fast enough. Playstation 5 will be the last set top box and then the companies profit line is going to tank as cloud competitors eat their lunch. Says they don't do stack level ranking but they do. Performance reviews have almost noting to do with actual work performed."
272,5,PlayStation is a phenomenal place to work,Software it analyst,Great work culture with a strong outlook.,Career paths can take a long time to progress in.
273,4,Great if you're not focused on pay and ambition.,Global manager,Chilled out place to worked that supports remote working,Not the smartest people working here. Dated internal systems.
274,3,So much red tape I'm drowning,Systems engineer,Great team. Slowly building up collaboration and trying to build up proper infrastructure.,"Corporate IT Policies block production progress at every turn. There is a HUGE disconnect and lack of communication between departments. No one knows what anyone is working on, and not just in secret projects but in building up infrastructure. We need to be working on coming together and bridging the gap between IT and other departments. They either need to give up our own environment to properly manage or to learn to work closely together. They believe obscurity is security. All this does is put a black cloud of paranoia over all departments and causes major administrative overhead and time wasting."
275,5,Very good,Administrative assistant,Nice place to work. Enjoyed it,"Very fast pace, very busy."
276,2,Dull,Artist,-Sony PlayStation project titles as portfolio,-boring and dull task - soul crushing
277,4,One of the best places to work,Senior software engineer,"Always up to date with new technology stack
Care about people and work life balance
Good salary and benefits",Hard to get promotions as there is lot of competition
278,4,was great,Community manager,"fun, enjoyable, gaming bonuses, interact with community",not as many off days as would like
279,3,"Lot of Politics, Bad Hiring",Senior software engineer,Great Company to work for. Interesting problems to solve. Great perks and Swags. Lunch every Tuesday. Lots of great internal talks and KT sessions almost every week. Bi Annual Hackathons where interesting projects are made and productized. Some of these projects are already in the market.,"- lot of Politics creeping in recently. - Hiring is rarely quality driven but more quantity driven. get a feeling managers are Not confident of brining in quality candidates so try to hire people without feeling entirely convinced - Growing Too quickly and now is unable to look after The Career paths of The employees. also leading to quantity based hiring. - unable to move out or motivate poor performers leading to bad team morale within The various teams - Tokyo is The boss which no one Can question. Tokyo teams try to take over work from US teams in an effort to get more work to Tokyo. - poor communication and coordination among teams. information is rarely shared among sites/groups since there is a huge fear of taking over projects by other teams. - Above all else, The Pay is much below market rate."
280,5,"Great place to work, with plenty of opportunity to learn and grow",Lead operations analyst,"- Fun place to work - exciting new things happening all The time - Great opportunity to learn a range of skills within It, Testing, development, project management etc.","- ceiling of job roles at times, and guidance on what to path to take next"
281,3,Office politics,Paralegal,"Flexible work schedule, vibe is relaxed and upbeat, good benefits, nice managers","Toxic work culture, lots of politics and meetings about meetings"
282,5,"Great company, fair pay",Principal engineer,"Cutting edge technology, good perks, great medical benefits",Slow paced environment. Siloed work
283,3,Not a review of SCEA as a whole. I predict that the boat is sinking at the First Party Quality Assurance department.,Contingent game test analyst,"I've never worked with a bunch of better people before. Fun and relaxed job. Of course, this is limited to my peers and my direct supervisors. I am extremely skillful and consistently win praises from them. Unfortunately, Senior Management doesn't know who I am. More on that in Cons.","Hours have been cut dramatically over the past year. I would have repeatedly returned due to overtime. I'm a person who does overtime for the success of the project and due to team loyalty, not necessarily money. But, due to changes by Senior Management that is gone and the quality of testing has suffered dramatically. Senior Management is comprised of friends and gaming buddies. If you're not their buddy, don't expect to get a permanent position and you don't necessarily have to be a good tester at that. There are a lot of lazy and useless permanent employees because of this. In a word: Politics. Temporary employees do not get any of the perks that a permanent employee do. This includes: Medical, paid time off, free games, food, and employee discounts."
284,5,engineer,Game developer,I love it so much,I can play and share my ideas anytime.
285,4,"Great place, bad pay",Sre/devops engineer,"Great perks, great staff, great managers","Bad pay, and the promotion path sucks"
286,5,Salary,Network administrator,You have nice people around you and its very good job.,For me the only problem is time because you work all day
287,3,Some highs some lows,Senior software engineer,"1. Very stable, consistently increasing business for the last 8 years 2. Many opportunities to work on something interesting 3. Working with a lot of nice and intelligent people","1. So so health plan: both wife and ex have a better plan than mine 2. Whomever wrote about the Intuit mafia in another comment here is right. 16 people got hired from Intuit in the last 6 months, and, it seems mostly for management positions. 3. Newer management in question doesn't really understand our business, and doesn't listen to old timers. They often act like they understand and know more about the platform than us. 4. Newer management makes a lot of ill conceived decisions that are discouraging real talents, thus increasing loss of tribal knowledge."
288,4,YOU CAN BE,Product manager,We at Playstation admire the workplace of engineers and coders etc,Ideas for games and easy coding experience needed
289,5,Wonderful Company,Regional manager,One of the best brands in the business,Globalizing the US market took 2 years. This was very unsettling.
290,1,Good Company Benefits. Poor Team.,Anonymous employee,"Decent Company Benefits
Free Games
Free Swags
Discounted Sony Products","Very Poor Management
Constant Bullying from certain peers. Felt like High-School."
291,3,Leadership is incredible and Management is terrible,Anonymous employee,"The leadership is fantastic. You will be hard pressed to find more visionary, likable and intelligent leader in your department. They have a clear vision of the future of the company, the possibilities and it's incredibly contagious. They will give you a lot of vigor to fulfill their dreams so that the customer is well taken care of. They're also not afraid of taking their own risks and trying new things (as long as it meets their superiors agenda). As much as they will deny it at PlayStation, a love of gaming is near required. Which is a pro if you have a affinity for games. A con if you are not.","Management is incredibly powerful and they keep that power for themselves. The simple fact is that you were hired for a job, and for that job only. While some companies hire for creativity, intellectuality, boldness. You are at PlayStation to fill your cog in the machine. Giving me the feeling of being a Temp / Contractor more than a Full Time Employee. For example, exploring other aspects of PlayStation (let alone Sony) is near impossible due to the dozens of security, management protocols and other walled garden approaches that the company has taken in order to enforce this. However, the leadership within PlayStation or those who have their ears, will enjoy pushing the boundaries of entertainment while taking advantage of PlayStations bright and friendly workforce. In summary, if you're looking for a company ready to invest their dime in you to take risks or explore in any facet of the word without being in a position of power, then you best look elsewhere."
292,2,Process Heavy and Politics,Product manager,- Cool brand - some teams are Fun - Cool initiatives in The pipeline,- Process driven company where change is slow - Lack of diversity (in all ways possible) - Politics between teams makes It difficult for newcomers to ramp up - work is done in silo and difficult to track owners
293,4,Good but not fulfilling enough,Senior software engineer,"Good compensation and great benefits, the company makes tons of cash so it's being very generous on annual bonuses, it even has a cash-equivalent Employee Stock Program. Significant annual increases pretty much guaranteed if you're a decent enough achiever, so even if you start average it can climb pretty quickly. Great morale, it helps to work on an industry leading console which blows records month after month. Awesome to be able to show people your work on your PS4 at home. Nice people overall, very laid back atmosphere, lots of video games and Japan enthusiasts. Good diversity and very respectful atmosphere among employees (no brogrammers)","A lot of mediocrity among engineers: some of them barely knew how to program, others would spend more time on social media than working, or even some more interested in running their own interests before their assignments. If you end up locked up in one of these teams, it's very hard to get out. Also lots of politics going on, way too much for me. I was also not a big fan of the widespread SAFE methodology and the over-reliance on tools like Rally which created lots of overhead. Working with Japan is interesting but also very frustrating at times, especially as they have ownership of the platform. Finally, very limited remote work options, given that most of the work requires devkits that can't be accessed outside the office."
294,3,"San Mateo is great, San Diego...Not so much",Anonymous employee,"I have been with the Company for almost 10 years now, and I can say that the benefits and perks that come with the job are great. We get paid holidays and yearly bonuses as well. The passion that the employees have here is great, and there are tons of creative people you get to work with.","As the title mentions, the San Mateo location seems to be a totally different company than it's San Diego counterpart. The culture in SD has not changed for years, and often employees are bringing up the same issues year after year. I love the Company as a whole but things need to change. Moving up in the Company is difficult unless you know the right people, and the poor performers stay around for way too long."
295,5,Great employer,Technical writer/translator,Great work/life balance and career development,Corporate nonsense can be time consuming
296,5,Best,Anonymous employee,Awesome place it work. A lot of benefits.,If you are temp struggle to find a perm job.
297,2,happy land for micromanagers,Anonymous employee,"Good benefits events large company hr, profitable business","Not a software company. Clock engineers. Big on timing, ops. No innovations. If you are here in person on time, that is all it is about. Best for hourly workers and watch dogs. Measure your performance by timing, not results. Very strange culture for software industry. You have to come to daily stand ups in person only. Micromanager does not time themselves though. ""It"" can come late and leave early as ""it"" wishes. Because ""it"" makes rules only for you. ""It"" is above the rules ""it"" makes. ""It"" can cancel or reschedule meetings at the last minute without any heads up although requiring you to give 24 hours notice to change a meeting. Because ""it"" ""owns"" the team including you. You are just a slave. ""It"" does not need to do real work. ""Its"" job is ----- watching you!!!!!"
298,5,Great place to work,Software engineer,Your Work is appreciated and rewarded,Compensation is low compared to other companies
299,5,Production Coordinator,Production coordinator,"Everyone is equally , our voices taken seriously by the management.",Jam to go to office
300,4,Good Place To Work,Sr.manager operations,"While it is a great place to work, salaries are struggling to keep up with the market and people are moving to other companies offering more competitive pay.",Work/Life balance can be a struggle.
301,4,Opportunity to try out ideas and learn new things,Staff software engineer,The leadership team is open to new ideas and technologies. Ops teams are supportive.,Teams are not managed uniformly. You need to find a good team and manager.
302,5,great place to work,Quality assurance,"working with great people, great atmosphere.",wage is a bit too low for the role this provides to the industry.
303,5,Good,Head of marketing,Great work environment and salary,Not much to say here
304,4,The Place to Work,Business analyst,A very good culture and acceptance of diversity,Lower pay bands than relevant competition.
305,5,"Clearly the organization is in the midst of change, but it is good change!",Software engineer,"This is an opportunity to work on a really cool product with a massive and rapidly growing global customer base. Your kids will be impressed. :-) New leadership is driving badly needed change, including a better focus on availability and a transition to a new architecture to support the next stage of growth. Management brought it from Intuit (and elsewhere) over the past couple of years are very good.",The organization is recovering from years of poor leadership that has left a bloated and inefficient organization. Many of the bad reviews you are seeing on Glassdoor are from a minority of disgruntled employees who are unwilling or unable to adapt to needed change. It is no longer acceptable to be paid just to come to work which is a good thing in my book!
306,4,Project Manager,Project manager,Project Manager Project Manager Project Manager,The cons for working here are
307,4,"Great company to work for, not much room for growth",Anonymous employee,"Genuinely feel looked after, especially throughout the pandemic. Great team/office attitude. great facilities.","little room to grow, employees that have been there for 10+ years are doing the same thing as when they started. Promotion policies limit progression."
308,5,Awesome team and scope for growth,Software development engineer in test (sdet),"People in SIE are extremely talented and fun to work with. The projects are just as interesting as PlayStation games. I got to explore several fields as an SDET, even ML. Managers are very understanding and flexible.",Not able to sponsor outside US
309,4,Good Place to work,Staff site reliability engineer,Very innovative Strong tech stack Supports Diversity Good culture,Security is eggregious Cross functional chaos too many acronyms meeting madness
310,2,"Fun atmosphere, but frequent layoffs",Anonymous employee,"There are a lot of great people and passionate gamers at PlayStation. There is also a lot going on and projects can change quickly, so if you thrive on rolling with the punches, you will be happy here. There is very little bench depth, so you also have to pull your own weight - but the people are willing to help and work a few extra hours so you can be successful.","Limited advancement opportunities and layoffs every 3-6 months. Employment is very unstable and management will not give you a heads up before you get a pink slip. In fact, we were told that no layoffs were being considered at a quarterly meeting by our SR. VP, yet 2 weeks later 50 positions were eliminated. Management is also pretty dishonest in general, and you can never get a feeling if the business is doing well or is in trouble. Finally, all the horror stories you hear about how people are ""let go"" in the gaming industry is very true at PlayStation - basically, your position was eliminated - give us your badge and get out."
311,3,"Good culture, not very competitive compensation",Senior brand manager,"Good culture, good people ad exciting products.",Does not have competitive salaries compared to other companies in the same area.
312,3,"Great place to be hired at, bad place to stay",Senior systems engineer,"Tons of openings, because all the long-timers are leaving; underpayment is the biggest single issue. Very competitive pay for new hires, which is the only way to get paid market rate here Excellent employee discounts Generally good benefits Very interested in diversity; diverse candidates should definitely apply - just don't stay long enough that your pay falls behind.","Zero effort to maintain current compensation for employees. Work/Life balance is a marketing blurb, not a commitment. They will tell you that you shouldn't work more than 8 hours a day and 5 days a week, and should use your vacation time, BUT will also hound you about maintaining deadlines which require 60+ hours a week to meet. Repeated statements that compensation will be brought current, but with NO follow through or broad correction, over a multiple year period. It's disingenuous at this point and the company is bleeding long-term talent because new-hire salaries are currently following market rates and going crazy, but no meaningful adjustment seems to be planned for existing employees. If you stay more than a few years, you'll see people hired in at your same job title making 10%-20% more money than you, just because the company does not value long term employees at all."
