Position,Rating,Review Title,Role,Pros,Cons
70,2,Forget about long term growth - Too much politics among the ranks,Anonymous employee,"The Singapore studio prides itself with a strong track record of successful games, notably as an associate studio contributing major features to the Assassin's Creed brand. Its early entrepreneurial spirit even led it to pioneer and champion the company's first major Online product Ghost Recon Phantoms. Developers here are extremely hardworking and passionate about their work, which can be exemplified by the titles that the studio has shipped.","The leadership is extremely cliquish and exclusive club. In order to succeed in your career, you can only either pull strings to be part of the club, learn to speak the same language or else you can only depend on your close allies to hopefully maintain your status quo. Leadership can also be extremely disorganized, with managers failing to perform regular 1:1s, set clear objectives or coaching direct reports into succeeding well. There's no transparency in communications. Requests often reaches the floor with hardly any impact analysis on tech or team's velocity, and ideas are changed flippantly and frequently. Culture has also shifted in recent years from that which was very family-like and people-centric, to that which is bottom-line and resource-centric. HR is mostly talk and no substantial action. Loyal and hardworking long-term staff (5 years or more) that decided to leave or got retrenched are often let go without compassion or renegotiations. Your fate is fixed by the club."
71,3,Time Bomb,Artist,"Stable, but if some competitor set up here, all good employee will flee.","Politics, French / Canadian have ++privilege and chances, subjectivity on promotion, paid based on nationality, HR is non-existant, 1 of 10 tech guy will be promoted and do all the work while 9 of 10 management will promoted because they all friends."
72,2,"Fun place, but swim carefully",Anonymous employee,"- Fun and vibrant environment - Experienced staff, you would be able to learn a lot from working with them - Pleasant and friendly colleagues who are willing to teach you - Accessible office, it's only a short 5mins walk from the Train station","- Office politics. Think Gun N Roses ""Welcome to the Jungle"" type of office politics. - No seriously, the song ""Welcome to the Jungle"" Describes the political situation in the office right down to a T."
73,3,Fun. Friendly coworkers. Multinational.,Animator,Friendly atmosphere. Promotes outside hobbies and activities for employees. Good amount of exposure to delve into specialties outside the employee's current field,Looks at the length of time spent in the company to consider promotion for its employees rather than the actual talents of its employees. Doesn't try much to retain employees. Will let them quit and then simply rehire new people.
74,3,"Great Place, Great Culture, Great Pool of Talent BUUUUUUT....",Animator,"- Fun people, great high profile projects, talented people. - Closely knitted bunch within the team - Free Beer and finger food on Fridays - Free overtime dinner compensations - Table tennis table","- Incredibly thick of office politics. Many cliques in the company - If you don't speak French, your pay scale is different. - Below average pay scale and yearly increments - Unclear career progression"
75,3,You can kill your time here,Anonymous employee,"Easy job, really. Not demanding due to follow-the-sun shifts and the corporate politics (that the team never gets any interesting work). You get to leave office at 5pm sharp.","A job too easy that gradually I burnt out. The other side, the bad side of leaving office at 5pm is that you come to the office at 9am. Even worse, it becomes 8am when daylight savings turns on in Europe and America, (though you leave office at 4pm)."
76,1,it could be better,Anonymous employee,"+ Nice people + Nice working environment and office location + Colleagues are very talented, you will learn a lot! + Good name in your resume",- Way much bureaucracy & politics at every level - Management is not transparent - Unclear direction usually obliterate the work - Slow to ship games (do not expect to see your name in there so easily) - Very high turnover - Low salary
77,3,Culture at Ubisoft,Anonymous employee,Ubisoft is a stable company to stay and work for. There are a lot of big titles that you can work at. and there are potential for growth. Its a culturally diverse company.,"Its getting more political especially if you want to move up. There are a lot of politics happening around. There are special treatment given to French people, its really biased."
78,2,Mediocre compensation,Junior technical artist,"Good training opportunities, maybe mentorship if you're lucky.","Salary disparity between junior and intermediate positions is huge. Company prioritizes experience by amount of games shipped above all else, disregarding actual skill level. Most software used is proprietary. People leaving every week, leading to experienced juniors teaching newer people with higher pay grades."
79,1,Stable but uninteresting,Technical director designer,- Job security - Lots of experienced peopel to learn from,"- Stuck in their ways - Low salary, only really given opportunities when threatening to leave - Projects are designed top-down, most people don't have any influence on the project and are just told what to do - Leads do not represent their team upwards, you're left fending for yourself - Relies a lot on people doing OT on a regular basis, but will not reward them - Very slow at decisionmaking"
80,1,Subtle racism and not-so-subtle misogyny,Senior product manager,None that I can think of right now.,"Worked at the Ubisoft Singapore office. It's all happy and fun times on the surface level, but when you stop and take a look around you, you'll notice that this place has been enveloped by a miasma of racism and misogyny. They pride themselves in having a multi-cultural crew. This is true, having employed people from a wide variety of countries. But this is just that - a statistic. Only one out of the ten or so top dogs and decision makers is actually local or from Singapore. Everyone else is a white, male French. There have been instances where the same bros were accused of harassing a junior employee. Said person was then relegated to another position, and was even considered to be promoted, just at another office in another country. This is just one of many incredibly degrading decisions made in this company swept under the rug and guised under the pretense of ""we are a family"" and ""we are inclusive"". Inclusivity and Familial bonds only exist for Frenchmen in this company. Skull & Bones, the game the studio has been working on has been a literal shipwreck for the past 8-10 years. Despite what the PR is saying to the public, it has been a game plagued (it still is) with management failures, indecisions, talent bleeding out and poached, and low team morale. I sincerely hope you think many, many times before joining this company, especially this studio. I have no ill will towards any of my former colleagues, they are the most talented people I've met, but its unfair that they are forced to remain in this sinking hole due to circumstance."
81,5,Fantastic Environment for Creatives!,Anonymous employee,"Great studio culture, energy & positivity So many talented people you can learn from Largest & most well-known game development studio in Singapore Ideas are welcome and appreciated Great work-life balance, flexible hours Opportunities to work on AAA projects that are significant in the industry Many opportunities for learning as long as you're keen! People always remember to have fun Awesome studio parties! Relatively flat hierarchy, friendly managers & bosses","More parties! Also, more allowance for recreation & skill development would be perfect, especially for creatives."
82,1,Massive turnover rate signals need for introspection,Anonymous employee,"Over the last three years, Ubisoft Singapore raised the bar in Singapore AAA game development. It produced Ghost Recon Online (now Ghost Recon Phantoms), one of the first wildly popular and financially profitable AAA games produced almost solely in Singapore. This proved that the local studio had the ""guns"" to make it big. It had talent. And it had nurtured even more talent through the grueling process of developing GRP. But please read on below.","Over the past year though a disturbing trend has been observed as more and more of that very same talent has begun to leave the studio in droves. Meanwhile ""positive"" glassdoor reviews that look suspiciously like they were written by the company's own HR department continue to appear. Perhaps it is time for some introspection Ubisoft Singapore. Ask yourself; how many of the GRP project managers, producers and game devs still remain in the studio? These were guys that worked 16 hour days. Persevered through 3 years of mad crunch. For little to no reward or profit sharing - and they still delivered. They became human capital investments that actually matured. They became the new talent base for future projecst. The studio's GRP-hardened veterans. They went through hell for their project and they didn't leave. Why are they leaving now? Do you think the trend can be easily dismissed, or is this part of a deeper cultural problem? What changed in the short year between the success of GRP till now?"
83,5,Producer,Anonymous employee,"Great projects focused on creativity People company, career growth is definitely possible International opportunities","Jobs are quite specific and the Tech is complex (ex: Several game engines, C++, online...). The game industry is demanding and competitive. It is not for everyone."
84,3,Strong history and good culture that is falling apart,Anonymous employee,amazing team mates and caring managers,"resistance to change low salary intimidation, fear"
85,3,Not bad,Programmer,Interesting projects Collaborations Lots of passionate people,"Sometimes they are too process oriented. To get good performance review you need to join in a lot of meetings, try talk a lot of people, basically the art of looking busy and active. Result doesn't really matter because result is team effort. Not a great salary."
86,5,Ubisoft Singapore,Anonymous employee,"- Great atmosphere to try things and meet nice people; - A lot very talented people from different parts of the world; - It is the only studio in Singapore that had significant successes in the past years (serveral Assassin's Creed games, TMNT, Ghost Recon Online). They have done in Singapore what no company was able to do before. People can work there and have a worldwide recognition. - Very much people focused;","- Still a young studio, has grown fast. Need to consolidate a few layers."
87,3,A good company to make triple A games with but get ready to be undervalued and underpaid,Level designer,The bond between colleagues and your respective teams is great and strong. The production pipeline is solid and clear.,Employees are often undervalued and underpaid. The management is bad at employee retention.
88,3,"Has very strong technical people, yet not appreciating them",Programmer,"- Fun to work, good culture - You have to work with talented technical people",- Feels underpaid (this may depend on where you came from) - Huge & dark politics cloud - Decisions and final calls are made by non-technical people (producers)
89,4,Recommended for good work life balance and team mates,Anonymous employee,"Good work life balance Great culture, great people, fun team Manageable workload Caring environment, good benefits","Good work life balance Great culture, great people, fun team Manageable workload Caring environment, good benefits"
90,2,To be avoided,Anonymous employee,Pretty good work life balance if your manager is great.,Poor top management which is not facing the reality and is not supported by a HR department which does not understand how to keep people. Overall people on the floor are great and talented but poor management practises and people ruin everything.
91,1,Good place for a career in politics,Anonymous employee,Best place for people looking to become a politician. Politics at every level.,"Not suitable for people who want to work on actual games. Mismanagement of game & people, therefore multiple delays time and time again. Game lacks direction. Employees & honest opinions are not valued. Not transparent with communication. Culture is very toxic overall, only yes men can survive."
92,3,mixed feelings,Engineer,1)Brilliant minds at work 2) You feel satisfied in producing great work,1) Late hours during project 2) Management remains mainly French - locals tend to get bypassed in management/leadership roles unless you get into their clique.
93,4,Trying to change for the better,Senior gameplay programmer,"- In recent times, there has been an effort to address the concerns brought up in allegations in the media - There has been more effort to reach out and engage with employees to see what can be done better.",- Salary ranges may not be as competitive with other studios delivering AAA content.
94,3,QA Tester,Qa tester,Talented group of designers and artists. Great experience working with them. Good experience working with the Leads. Able to learn a lot from them,Slow career progression. Office politics can be annoying. Salary is lower as compared to other companies. Some producers have double standards when it comes to hiring and promotions.
95,2,"Good, bad, and very ugly",Programmer,"Exciting, challenging projects. Good opportunity for junior to learn gamedev tech.","Producer centric, communication overhead. Managers know how to play the stick-carrot game very well. You will find it exciting at the beginning till you know the game."
96,4,Great Place to Work!,Anonymous employee,Company takes care of those that do well. The organization really encourages and aids in career progression and growth.,Can sometimes be frustrating when dealing with communication with other studios if they happen to be a mainly French speaking. It would be advantageous if you're French speaking.
97,1,Poor management at the top,3d artist,- Strong player in the market and IP,- Low pay - No career path - Too dependent on current IPs - Strong turnover (the colleagues I started with have all but resigned) - Lots of uncertainty in the future of the studio - Some of the work are going to Philippines and Chengdu studios making the Singapore one a costly one - The company has no identity
98,3,"Great learning, very creative individuals, bad pay, mild racism.",Producer,Very creative place People focused on making great games Lots of freedom to creative individuals People centric,"Poor paymasters Singapore studios pay based on passport, not talent French ceiling to growth within the company"
99,2,A Loooooot politics,Anonymous employee,"Good titles if you are reallllly interested in game industry, and some awesome young people to work with. That's it.","Fruit only once per week, low salary !! Horrible management !! A lot of politics, they don't promote good workers, they promote good ""game players"", are you good at playing ""games""? If not, don't come."
100,5,Great place to work,Level artist,They take care of their employees and offer a very flexible schedule for a nice work-life blance,If you don't like big companies and you want to have a much bigger impact on a project this might not be the studio for you.
101,4,Studio is trying to be better and the results are showing,Software engineer,- Great benefits - Steadily better work culture,- upper management on game projects are disillusioned
102,5,Great company to work for!,Talent acquisition manager,-Work with many team of super passionate people -Multi-cultural work environment -Strong culture of fun & entertainment -Lots of perks & benefits,"-Long production cycles in game development -Work from home because of Covid (going back to office soon) -Can't hire all best talents for the studio, also partially due to Covid"
103,3,-,Anonymous employee,Great work/life balance and studio life before WFH period of time. Fun colleagues. Great start for a fresh graduate.,Compensation is not the most competitive in the local industry. Office space is very lacking and not as expected from a triple AAA developer in the game industry.
104,3,Great colleagues,Project manager,Great and passionate colleagues. Open to suggestions from peers,High hierarchy structure. Looks to have bias to be french speaking in order to climb up the ladder.
105,3,Project Coordinator,Anonymous employee,Good learning experience Get to know people who are passionate with their jobs,Quite a handful of inter-politics and micro-managed to a certain extent. Tenancy to promote their own people and ratio between management to the chaps working on the ground can be unjustified.
106,4,Good place to work at,Anonymous employee,- Vibrant and open working environment - Friendly colleagues,- Career development - Strong French influence
107,3,OK but...,Level designer,"Great team and very friendly people in the office, everyone gets along easily with most of the people there due to the openness of our studio.","Just like any other companies out there, what's on the surface is not what it seems."
108,5,Artist at Ubisoft,3d artist,- Amazing company culture - Good management depending on project - Flexible working hours,- Work can get mundane and repetitive - Overly safe in decision making
109,5,Experience,Junior level artist,"Good benefit and bonuses, great place to work, able to push yourself",Can have a higher salary compensation due to stressful environment will be great
110,4,Good for starting in the industry,Project manager,"- Good work culture and environment, people are friendly","- pay is low, talent keep leaving because they don't believe in the project"
111,4,Nice place to start your game dev career,Anonymous employee,You can learn a lot from industry veterans.,There’s a high chance your project gets canceled and your years of hard work goes in vain.
112,3,Good company with bad leadership,Anonymous employee,"A big company with good benefits, flexi bonus and good peers.",Management unable to decide on vision and lead a big project to fruition.
113,5,Cool place to work,Software developer intern,Cool and fun place to work,"Cool place to work - too cool and distracting, need to be very disciplined"
114,2,Tedious,Qa tester,Work with experienced people and passionate developers,"Management only focused on bottom line, not employees or work culture"
115,3,stable job but tough to go up,Computer programers,great benefits unlikely to move up,some projects are in development hell
116,5,The Ubisoft Group,Production manager,"A large company filled with a lot of amazing people, all collaborating well to create a quality game.",You can’t find this anywhere else.
117,4,A great place to grow and create,Anonymous employee,Creative work environment. Employee caring policies. International opportunities.,Painful decision processes. Not a very generous payer. Lack of focus on priorities
118,3,Eh,Gameplay programmer,"Job is easy, relatively boring but personal prefence if you want to be part of the corporate machine","Big companies, wasted work, the usual"
119,1,Free education in office politics,Anonymous employee,"Good location, great work-life balance and flexible hours.",Unless you are French or an expert in navigating office politics. Kiss your career goodbye. Promotion and reviews are based on relationships and politics.
120,3,Could be better,Vice president - it,Pros Salary is very good,Cons everything else that comes with the job
121,4,Getting Better,Digital artist,Interesting work and Free games,Management has a lot to improve on which they are working now
122,3,Good starting point,Audio designer,Good starting point in the game industry,Certain projects went through many direction changes and take very long to ship
123,4,Great place to work at,Programmer,Team culture is great and clear career progression,Game dev is generally hard and you will need unlimited passion to burn
124,3,Not Bad,Anonymous employee,Learn lots of good stuff from veterens,Stuck in the open-world concept
125,4,good company,Anonymous employee,good people nice environment fun environment i like it a lot is a good place,the salary is not good unless you are top management
126,4,n/a,Programmer,Provide good work life balance.,pay is low comparing to market
127,2,Ok for a start,Lead programmer,good to acquire industry experience,politics and unclear direction if you work on the local title
128,1,Used to be a good studio,Senior level designer,- Nice people - Biggest v.game company in Singapore,- Future is uncertain - Management is not transparent - Political - Whoever talks the most or loudest gets to be heard
129,4,Lot's of learning opportunities,Junior technical artist,Great place to improve technical skills Attractive benefits,Team is under staffed Low salary
130,5,Solid AAA game development,Anonymous employee,Solid AAA game development. Nice work-life balance.,Messy top management. Hope it's changing in the coming years.
131,1,Programmer,Programmer,Nice people to work with,"Incompetent management. Don't understand what they're doing. Wasting tons of money. Don't communicate with each other. Tons of crunching, sometimes on work we know will be undone later."
132,5,Programmer at Ubisoft,Anonymous employee,"A lot of talent people to learn from, good culture, interesting work",Talent retention policy (regarding salary)
133,4,Good place to learn,Anonymous employee,"Family friendly, good vibes around",still finding our place within the ranks of other world class studios
134,4,Cool place,Tech,Great place to work lah!,Pay could be better lah!
135,3,assistant art director,Anonymous employee,multi talented team from different background and cultures,management needs to improve in terms of responsiveness.
136,4,Good place,Project manager,The team and the games,The politics and the size of the office being a bit small
137,5,Great company,Business intelligence manager,"Fun, Innovative, Exciting game projects",Studio limiting number of opportunities Salary
138,4,"Good culture, good employer,",Senior designer,Great working culture Great Quality of life balance,Needs better design leadership Needs better innovative practices
139,4,Enjoyed it,Anonymous employee,"Manager was great, fun culture, some great games","Political, upward mobility is limited for non-French"
140,4,Not bad at all,3d artist,Welfare / good coworkers / nice office,Not much to say for now
141,4,Good place with talented people,Anonymous employee,Nice working Environment Good office culture Talented individuals,Low Salary People retention Very Long Crunches
142,2,"Lack transparency, poor communication practices",Anonymous employee,"Flexibility, game benefits, fun culture",Lack of transparency from senior management and HR
143,4,IT support,Anonymous employee,Great Culture and lots of learning experience.,Unrecognized your value of work contribution.
144,4,Project Analyst,Anonymous employee,"Great energy, good work-life balance.",Not everyone agrees to company core value
145,1,Current Employee,Anonymous employee,Good location and flexible hours,"Management and directors quite disconnect with employees. Claim transparency, is anything but. Questionable decision-making process."
146,1,Low pay,Junior programmer,Can learn a lot about the custom engine and processors,Pays are lower than software engineering jobs
147,1,Nice environment but not competitive,Anonymous employee,"Good environment to work, many seniors and experts",Not competitive comparing to other companies
148,3,Ok if you like constant change for the worse,Qa specialist,"Good benefits, free coffee, free fruits, gym membership, reduced public transit","Constantly changing policies not the in the best interest of employees. After years of avoidance finally came out with a 100% work from home policy. People moved away, sold their houses, changed their kids schools. Not even 6 months later they turned around and said yeah ooops just kidding, loooool. and forced everyone back in office 2 days a week. Not even a year later they are now forcing everyone back in office 3 days a week. There's no free parking unless you arrive at 6am and taking the bus and metro for some if not feasible or possible. They fired all the long term people who worked in the gym for 20+ years and replaced them with a horrible 3rd party company and gave access to people outside of the organization. So the gym could have even more bros invade it. Everything they do is for $$$ and not for the benefit of the employees. 80% of the company shouts from the rooftops how their policies ruin their lives and they suggest we talk to mental health professionals to help us cope with the horrible changes they are constantly imposing on us. They say people want to come into office, but when it wasn't inforced hardly anyone did. I think that speaks for itself. They give fictitious reasons for their arbitrary policies. Good luck with that. I for one will not stick around to see this get even worse. Plenty of fully remote companies out there to work for."
149,2,"It is like in China, you give up freedom for job security",Anonymous employee,"Ones you are hired, you will not get fired that easily. around 80% of your work will be for the ether anyways, so do not stress out and enjoy an small-average paycheck","For people that actually want to move and create things, that is not the place. There is so much red tape everywhere and toxic positivity is in place while the department directors and up have no clue about why their games are getting worse"
