Position,Rating,Review Title,Role,Pros,Cons
1,5,Nice place to work,Senior programmer,"Great people, good work-life balance.",Relatively low salary compared to other company.
2,4,"Great work culture, welfare and people, but low compensation",Junior gameplay programmer,"- Comp time for OT - People are great, work culture is respectful - Inter-project mobility. I never hear of people being let go at the end of a project","- Bonuses are basically non-existent so far during my time here. Company wasn't doing well last year. - The pay raise last year was extremely low, at 1.7% for me, and it is known that there were 0% increases for certain job levels. - In my project, it felt understaffed but overdemanding. All of us had to do more than was healthy for work-life balance, and even though there was comp time for OT, not being able to spend all of it was an actual concern as the project could not afford some people to leave. It should be noted that I have never heard of leave being unapproved for this reason however, but there is stress coming from expectations and sense of responsibility to consider."
3,4,Comfortable enough,Ui artist,"Depends on the team, but I am given a lot of freedom on how to solve tasks. HR Does take care of people and organises events for welfare.",Short timeline means you fix stuff even if it's spaghetti code or temp fixes. Many temp fixes builds up tech or design debt that creates a cursed problem.
4,3,AAAA,Junior user researcher,"Chance to work on some good games and get good experience
Clubs can be a fun addition to work","Slow growth and challenge
Politics exist as with large companies"
5,4,Fun plave,Level designer,Young and lively environment to work in,"No 13 month bonus, unable to have quick career progression"
6,4,A solid employer,Senior ui artist,The possibility of working on big projects and being around amazing developers,"Work can be very restricted, they want you to do ""your"" thing, without much space for lateral movement"
7,3,"Great culture, low pay",Anonymous employee,"great culture, good HR, great welfare","low pay, some hierarchy involved some times"
8,5,"Level artist""Assassin's Creed Red""",Model artist,"As a model artist, it's challenging to start level art. By figuring out a lot of methods and asking colleagues and team leaders for advice, I was able to get started quickly and complete the project tasks successfully.All my supervisors have recognised my personal attitude towards work and my ability to learn.","Due to the individual open world level art experience is too little, can only do some medium difficulty missions, too complex challenge of the mission still need to experience accumulation.Learn more to improve"
9,4,Very nice company to work fir,Lead animator,"I was lucky enough to work with some talented artist, company really care about the people there",Work can be a bit caothic sometimes
10,4,Good company to work in,Senior ux designer,"Interesting projects
Non-toxic multicultural environment
Quick interview process","Bad planning
Bad game direction"
11,5,Great,Junior development tester,Good benefits and Great people,Pay could be alot better
12,3,Respectful culture,Anonymous employee,Respectful culture in general and young team,Poor salary and benefits for employees
13,5,Working at ubisoft,Level designer,awesome and amazing place i think,its improving and i think its fine
14,1,Leadership is still as toxic and misogynistic as ever- nothing done to improve ongoing toxicity,Production assistant,"You get free fast food dinner when forced to work late and aren't allowed to go home to your family or take your vacation. You can thank the COD egomaniac (a perverse, sexual predator who talks and eats more than he delivers). Exec team (local and when visiting from Paris HQ) frequent sex workers and vast amounts of alcohol consumed at work and tacky cliche work events. Ongoing racism and discrimination toward Singapore team members. No accountability, toxic to the core. Fake PR about improving work culture and inclusivity.","Big legal cover ups to stop any real change or improvement. Finally launching an out of date, mediocre game. Reality is Ubisoft uses Singapore as a tax haven."
15,1,Working in ubisoft singapore,It support analyst,Good environment and healthy culture,Bad management and low pay
16,2,Talent and culture being squandered,Mid management,"Nice folks on the dev floor. The actual experts, often hidden are seriously skilled. They really go at the diversity and inclusion. Devs work hard to meet some crazy expectations.","Micromanagement of every level especially from HQ Non-expert mavericks exist - who will disregard real expertise, these are often production and HQ self declare experts in all fields from anything like tech , design, art and making AGILE changes but are actually going in circles - which are obvious. Top layer clearly oblivious to on the ground realties. Too many directors and directors of directors lost touch on game dev processes. Lots of fuss on minor subjective details that make a game Costly to realize the egos of these higher ups. Poor accountability for mistakes made Your opinion and decisions don't matter since there will be someone above who will randomly undermine it New age moral policing that will stifle a innovative culture Salaries can't keep up with inflation"
17,3,Learn and get out,Junior gameplay programmer,Solid workflow Good for learning the standard of SDLC,"Bad upper management Bad compensation package - no bonus, low pay raises, bad healthcare package"
18,2,Learn exactly what not to do,Junior gameplay programmer,Mature CI/CD processes Working in one of the many teams that contribute to a project Learning to work with people from different disciplines,"Stubborn directors that don't listen to developer feedback Conflicting instructions and opinions from different studios, affecting project direction and progress Competent mid/senior level programmers compensating for the incompetent ones Promotion by years of service, rarely by merit, can be affected based on whether your manager likes you personally No bonuses/CVB"
19,4,Great place to start your career,Technical artist,Awesome culture and passion for the work,Compensation is not very competitive
20,5,Great overall,Junior level artist,It is a great place with great people and ok benefits. Good culture and AAA projects.,"No thirteen-month bonus, the increment might be slow."
21,2,+/-,Anonymous employee,People are nice Free games,Salary is quite poor and OT is a must so get hit twice.
22,4,Good people to work with,Sre/devops engineer,A lot of great people to work with Big place generally professional,"Upper management can be difficult to work with, with certain decisions getting delayed or ignored. Frustrating back and forth on work decision at times."
23,3,Decent culture not that attractive remunerations,User experience researcher,Good ppl Good food Fun,Poor remuneration Slow progression Not good bonus
24,4,decent place to work,3d animator,good people good benefits/work-life balance good culture,very low pay increments lack of manpower for projects
25,5,Senior Concept Artist,Senior concept artist,Great work culture and work location,low revenues compared to other companies
26,3,"Uninspiring, mediocre but comfortable",Senior technical designer,"- Stable company - International company, with a lot of experienced staff - Great place to learn, if you are open to it","- Low salary - Projects are bland and uninspiring, always follow the same kind of direction - Political nightmare. Information is hidden/not visible to the managing director of the studio. Little trust in core leadership from the devs - Professional advice / opinions from experts often ignored in favor for someone's 'gut feeling' - HR is the worst I've ever seen in any company - A lot of overtime for the developers, often caused by something stupid which management was informed about MONTHS ago"
27,4,Good to work at and passionate colleagues,- company benefits are pretty good - talented people to work with,- long periods of crunch - certain toxic people are hard to work with,
28,5,Work life,User researcher,They really respect work life balance and take care of your welfare,Can’t think of any for now
29,4,Good,Senior programmer,"Good atmosphere, people help each other",Random orders from the apper management
30,4,Good company for its time,Sr ta manager,"Worklife Balance and Good colleague to work with. Strong employee engagement, such as wellness gifts during Covid period Passionate and talented employee",Poor leadership management and lack of direction in its game IP production
31,4,good place to work,3d animator,works on AAA games. good benefits packages.,working on different projects may yield different experiences. different bonuses.
32,4,Fun place to work.,Senior technical artist,AAA studio. Good work. Interesting challenges. Lots of opportunities. Fun place to work,"Lately, projects are stale. Need more projects to come in."
33,2,Great benefits but not,Anonymous employee,Great benefits and good work-life balance.,"Pay is below market rate. The business outlook is not great, and the company clearly is heading in a direction to please their investors rather than taking care of their employees"
34,4,Great employer,Gameplay programmer,Very pro people. Everyone is very friendly.,More opportunities for different projects.
35,4,alright,Concept artist,"good people, good collaboration. work environment alright.",very low pay increments lack of manpower for projects
36,1,No direction,Associate producer,Some really talented people working in the studio,Management has no clue what they are doing
37,4,its a okay place,Quality assurance,minimal micromanaging welfares are still good at the moment,nothing to say at the moment
38,3,Great game production company,Human resources director,Very pro people. Everyone is very friendly.,Great training ground for young and inspiring entering gaming world but hunting ground for competitor
39,3,Well,Senior technical artist,Great people and awesome project!,It's a good company to work here.
40,3,"Great team, too many cooks",Senior game designer,"Everyone can have a say, provided you have the right tone and angle of approach. Great people.",Production processes slow down development. HQ often has too much sway. Yardsticks move.
41,4,Standard Job,Full stack developer,Have good work-life balance most of the time,Pay is not enough competitive
42,4,Good work balance,3d artist,Great work life balance Great art culture,Salary compensation is not competitive compared to other studios
43,5,Good company to work for,Programmer manager,"Great people, good processes, and engaging work","Poor benefits, poor career progression and salary"
44,3,Negative Work circumstances,Anonymous employee,Autonomy over your work. Minimal micromanaging,Game project has been continuously delayed and making team lose confidence and faith. Senior colleague and manager on the role are not empathetic to the circumstances of your work situation
45,5,Good place to work,Level designer,Welfare and benefits is great,Progression may be a little slow
46,5,,Senior hr manager,A Caring company with good benefits,Long hours for game development
47,2,Nice working environment but not somewhere i recommend to seniors or higher due to below market salaries and slow growth,Senior programmer,Casual working environment Flexible hours Autonomous daily experience.,"Very low pay incrementVery slow career growth. (2 years at junior, 4 at intermediate, 5-6 at senior

Bloated dev teams that arent open to hearing ideas for a game's direction. Most major decisions are dictated by the HQ studio. You end up feeling like a cog in a machine and eventually lose interest in the product.

Creativity takes a backseat to ways to get more and more money out of the player after the sale of the product. In the past youd have a creative director but now you have a committee of finiancial and engagement members that have tunnel vision on specific metrics and it makes the product much worse as a whole.

modern ubisoft games introduce a lot of addictive gambling elements aimed at kids.my morals dont align with that

Very Low salaries.

Glass ceiling in the company if youre not a french speaker or national.

A lot of french conversations on the floor even though it's supposed to be an English speaking company. Groups seem to form based on this and it factors in during performance reviews if youre very close to the french group

Project bonsues are tiny. On a game released in Ubisoft' most profitable year ever, selling over 10 million units. The bonus was less than a month's (already slow) salary for a 4 year projects lack of manpower for projects"
48,5,Fun colleagues,Anonymous employee,Fun colleagues guaranteed whoever you meet,"Low compensation, not the most interesting game projects you work on"
49,5,,Level artist,Amazing work life balance and fun working environment,Some tend to take things too lightly due to fun working environment.
50,4,Good place to work,3d artist,Good work culture and work life balance,The pay is on the lower side
51,4,Ops team,Anonymous employee,Culture is great and fun,Management for the ops team can be better Too much is focused on the production team Rewards as an ops team is not as rewarding compared to production
52,2,horrible indecisive director that dont know what they want,Software engineer,a good glimpse into tech for AAA dev good work life balance,horrible pay and bleeding talent
53,4,Great place to learn,Programmer,Many mentors to learn from Work on massive titles Very in-depth work with game engine,Low to average salary compared to normal tech firms Progression can be challenging after many years
54,4,Short review,Designer,The culture for the company is great and fun.,The pay for the company is not that high.
55,4,Great Environment for those who want to make a difference!,Anonymous employee,"Open environment - Really helps on communication. Just take the initiative, anyone from senior management to junior employees are always willing to talk. Great Business Mind - Talk to more people who manages projects, department(s) and studio. You will pick up more knowledge about the company and business direction. The future of the organisation is bright in this competitive industry. There are many senior guys whose first job start in this company. That explains! Knowledge sharing - A lot of time, effort and money is spent in development of knowledge and training of the employees. There are many workshops created developed especially in the last few years. Values a lot on sharing expert advice (internally and externally). Not many games developers are doing to this extend! Local Talent Development - The Singapore studio emphasis the importance of developing top local talent. That's a very good area to develop and strongly encouraged!","Works with multiple studios collaboration. A lot of functions works with various studios and offices. Can be challenging when it comes to time zone collaboration. Which MNC has no challenge on this? However, it is also good that every studio is learning from one another yet growing the expertise knowledge at the same time."
56,4,Okay place to work,Technical artist,Fun work environment. Good place to work,Salary can be better. Still higher than the competition i guess
57,4,Pretty Decent,Junior quest designer,Plenty of opportunities to broaden learning experiences,Long work hours at times
58,4,Great WLB,Publishing,Great WLB and leadership understanding,Could take more calculated risks
59,2,Incompetent Leadership begets incompetence.,Developer,Job security Good workplace culture Good work life balance Safe country,Leadership and Production management are generally incompetent. More focused on impressing upwards than they are motivating or empowering a team. Anyone with any experience in identifying problems is often stigmatized as negative and not working well with the team which is just leadership speak for shut up and sit down. Leadership is top down order driven less you incur the wrath of management and your career is stalled because they don’t like you. Promotion process is more a popularity contest on who has the best rumor about you. Milestone objectives are a joke to be spun into successes based on vague goalposts. Work gets redone and redone because leadership rarely has any idea on what work actually gets done because they are more interested in PowerPoint presentations than actual technical or production competency. Is it any wonder the turnover for senior developers is so high. Only a handful of devs in the studio who has been here longer than 5 years. The rest can find more fulfilling work elsewhere.
60,1,"Good people, bad management, uncertain future",Developer,"- Nice people. Most ppl have good attitude to work with. - Biggest game company in Singapore. - Good work and life balance, flexible hours. - High quality standard, always industry benchmark AAA titles. - Project has strong marketing and brand IP.","- Future is uncertain, project constantly change direction. - Management is not transparent, one hand claims everything is awesome, another hand is downsize the team. - Political, whoever talks the most or loudest gets to be heard. If you speak French you will got bonus influence. - Low pay, downgrade rank title, no career path. If you are French pay is much higher. - High turnover (both local and expat colleagues have high turn over rate). - The satellite studio Philippines and Chengdu studios making the Singapore most costly one. Production work has slowly shifted and leaving the employees with uncertain future in Singapore."
61,5,one of the strongest studios at one of gaming's best companies,Producer,"Ubisoft is the best of the bunch for big publishers in the video game industry as an employee. I appreciate the decentralized decision making (teams have a lot of autonomy), the values which extend all the way to the top of the company at the c-level (trust creative people, and they will do great things for you), and the support. The Singapore studio has exited its ""startup"" phase and is becoming a more mature studio - but hasn't lost its ambitions. It's still a place where I feel a lot of energy and enthusiasm when I walk through the doors every morning.","Every company has niggling issues - and Ubisoft is no exception. One of the big trade-offs is that game companies tend to be ""led"" by one group or another - design, tech, marketing, or business. At Ubisoft, its business and design. Which means that technology, for example, is viewed as a ""solution to specific problems"" rather than something that enables new businesses. If that's what you're looking for (hardcore R&D), Ubisoft is no Google."
62,1,Choose your friends wisely,Anonymous employee,"Ubisoft Singapore has, in the past, collaborated with other studios to create AAA games like the Assassin's Creed franchise. Great learning experience working on AAA titles.","The politics are incredible. Your skills account for 10% of your performance during the yearly review. The remaining 90% is dependent on who you are friendly with and who hates you. If a manager in the studio (not necessarily your manager) does not like you, he will find all sorts of excuses to have you fired. He will try to convince other managers that you are difficult to work with and if a majority of them speak out against you, you're out. On the flip side, if you're best buddies with your manager, he can find reasons to rally the other managers to his side and give you a promotion. Some have been promoted this way."
63,5,Life at Ubisoft,Anonymous employee,"Contrary to other Glassdoor articles, this company actually tries very hard to promote local talent - there are several examples of senior local talents in the company. Overall a very fair and vibrant company to work for. - Healthy mix of asian and western nationalities - Very casual working environment - Comparable salaries compared to other local game dev studios - Strong emphasis on team health during bi-annual lead reviews - Care is taken during scoping process to manage team workload - AAA game development on top IPs - The studio here is given a good amount of freedom to work on their own ideas","- Crunchtimes, but has gotten better in recent years - The bar is set high in this company; everyone is expected to perform - Bonuses are based on project sales, sometimes there are no bonuses - Annual leave is minimal - Salaries are not competitive for junior and intermediate positions - Benefits and healthcare are not amazing compared with local MNCs"
64,2,Great Talents killed by top management's politics & bureaucracy (Singapore),Anonymous employee,+ Nice work & life balance + Promoted easily based on senior relations + Nice people. Most ppl have good work attitude + Biggest game company in Singapore or Asia + Nice studio of friends (Junior to mid levels),"Unclear direction on game strategy which often led to conflicting priorities Senior Management had trouble acknowledging ownership or committing to new directions Very top-down or laissez-faire style by leaders which prevented honest conversation about problems Lack of coordination across functions due poor organizational designs Inadequate leadership time & attention given to talent issues (usually ignored or dismissed) Employees feared of telling the senior team about honest inquiries or opinions. (based on former employees being reprimanded or wrongfully dismissed) Observed long-term, loyal employees being overlooked by alliance relationships with Seniors (French) Very unclear career development Low salary High turn-over (3-5 employees left a month. Unannounced, terminated or resigned)"
65,3,Ubisoft Anonymous,Anonymous employee,"Very European place to work. Days are flexible, family comes first, and most every project is encouraged as a bottom up initiative, rather than a top-down mandate. This gives you lots of room to propose good ideas, and develop them within the company, regardless of your role or stature.","Because of that lack of top level guidance, you spend a lot of time negotiating and playing politics with other teams in the organization - building alliances and support to budget and execute projects that are cross functional, which can be great for someone who has the political clout to drive that, but if you're just interested in getting things done and not playing politics, it can be stifling."
66,2,A beginner friendly studio,Anonymous employee,Excellent learning opportunities Work is demanding in terms of time commitment but less so in brain power Great for portfolio,
67,2,"Good QoL culture, but lots of politics",Anonymous employee,"Good quality of life, competitive salaries, relative job stability, and they allow for a reasonable work life balance. The location is also an amazing place to live as well.","Very thick management layer, and most of them were never in the trenches so they tend to not know when an issue needs to be reacted to and when it's a minor thing. A great many bad decisions get made out of lack of technical knowledge and understand as they do not seem to trust their tech leads to properly advise them. The management layer holds all of the keys, and people on the team do not feel as though they are being heard."
68,1,New Army General in the Singapore Studio,Anonymous employee,Good starter for resume sake,"The new MD is an authority figure and wants only followers. Defy his orders/wishes means career suicide. Those who follows are pets (usually the incompetent) and that's happening from very senior people down to leads. Wants to brand himself as a ""hero"" but never had that capability to manage a company. It's only orders, orders, order. HR is genuinely a great team but lacks much empowerment. This company is losing a lot of local talent in the past years. So called AAA project is still unknown to release. Wants to a leading tech company but lacks comps, culture and senior people who can innovate. Weird that there are a lot of directors getting fat salaries actually don't get fired. Studio with BIG PROBLEMS!"
69,4,"Great company, cares about game(r)s",Anonymous employee,"Really cares about game quality High quality IP's (Far Cry, Assassin's Creed etc...) Not afraid to take calculated risks and invest in creativity A lot of international / relocation options Yves Guillemot a great CEO and a quality human being","Work life balance is still not where it should be at the end of projects. The top tier of the company is a small clique of friends/relatives from 30 years ago, some of them have not scaled alongside the company and don't quite have the professional ethics. As such, they tend to let things un-managed instead of making bold moves. This sometimes leads to situations getting worse overtime, and impacting many quality employees."
