Position,Rating,Review Title,Role,Pros,Cons
332,4,Anonymous,Communication trainee,It was a good internship especially if you like video games. The educational workshops for highschoolers were the best to work on.,Salary is low Diversity (male dominating industry still)
333,4,A very pleasant experience,Data engineer trainee,"The team was comprised of great people, all very friendly and helpful.",The management was very chaotic.
334,3,Goon vibe but poor financial situation,Ui & ux designer,"Amazing colleagues, plenty of chances to learn and grow","Incapable management, decreasing future opportunities and career development due to extreme cost cut (specifically for German studio)"
335,5,"Overall, very good place to work","Manager, information technology",Great people to work with. Very talented members. Work environment is very casual.,Growth opportunities are limited for some positions.
336,5,Good culture,Motion graphics designer,"Good culture, good people, good food , good life","No cons as such, everything is good"
337,4,Overall a good company,Research and development engineer,Great work life balance Great culture,Less average salary Not completely remote
338,3,Fine company to work at,Quality assurance,Fine to start and enter industry,Hard to grow at some point
339,4,A good game studio,Junior game tester,"Good working environment, everyone is nice and helpful, not much pressure",Salary is not good enough
340,4,Review Security Analyst at Ubisoft,Security awareness analyst,"Very fun company and safe working environment. The balance between work and personal life is not to be messed with, and working with people internationally is very fruitful and enlightening,.",Growth opportunities are very limited. there is no clear career path and although you get raises and annual bonuses you don't really progress greatly when it comes to job titles and careers.
341,4,Senior LA,Senior level,"cool people, lots of different projects.","hard to move up, low salary's."
342,5,One of the best companies to start with,Associate team lead,Makes your base really strong,No cons as such from me
343,1,welp,Community representative,"Free games, good people, and some event","Unstable IP, not a well-made games"
344,4,Review,Ux researcher,Best colleagues in my entire life,Management decisions are not the greatest
345,5,Great Company to start Gaming Career,Qa engine,Awesome working environment Great Managers,Nothing much cons great place to work
346,4,Review,Cyber security analyst,awesome perks and offices and tech,salary and budget are not great
347,4,Good internship experience,Software developer,"Great initial setup, got to develop new skills pretty quickly.",In my internship I got to see issues between management and devs.
348,3,Good starting place in the industry but don’t aim long term,Qc project lead,"* Generally good and friendly atmosphere * Good working conditions * Salaries and bonuses always on time * Opportunity to learn and to grow, given the right leadership","* Actual growth is slow and painful * Salaries are a joke compared to the current inflation, life costs and job responsibilities * High expectations vs low rewards * Highly questionable upper management (directors, not managers/leads), disconnected from actual team and project dynamics * Anxiety and burnout inducing workloads for uneccesary heavy tasks * Habbit of overworking managers and leads * Oppinions regarding compensations and actual employee struggles are generally ignored during Q&A’s * As hard as it tries to promote a strong people culture, it misses this exact target by treating it’s employees as easy interchangable parts"
349,2,Low salary for seniors,Senior qa tester,People are nice and the environment is welcoming.,Low salary for seniors after many years of experience and no opportunities to grow
350,3,Tester for pc and consoles,Qa game tester,People are very friendly as long as they are not a Lead or managemenr,"The management is awful and rarely you get a raised. If you do, is like 3% of your salary"
351,2,good,Team lead,"good, food, cool , culture, safe","less salary , bad management, uneducated people , no creativity"
352,4,Best workplace,Customer support representative,In terms of Work life balance and understanding best work place,Salary not matching as per industry standards but give lots of opportunities to learn and grow
353,1,A cautionary tale of mismanagement at Ubisoft,Software engineer,"Good place to get some experience, but nothing more.","After years at Ubisoft, in both IT and Studio departments, I've seen a trend of mismanagement and directionless leadership. The main issue is with the department directors, often inexperienced and showing questionable decision-making skills, especially in IT. Working conditions deteriorated, leading to the downfall of promising products and the exit of skilled colleagues. Despite the toxic environment and poor leadership, I managed to focus on side projects, ironically receiving full bonuses for minimal effort. However, the mass layoff of over a hundred employees just before Christmas, paired with extravagant parties, highlighted the company's mismanagement. For those considering Ubisoft, especially in Montreal, better opportunities await in smaller, more dynamic companies."
354,4,Solid industry leader,Senior game designer,Good strategy and care for people,Base pay is usually lower than competitors in area
355,2,not a good start,Associate qc lead,"chill, friendly culture, cheap meals","not good, politics, favorism, less salary"
356,3,"good place for new emplyee to get experience, not recommended long term if you are not local resident or French",Senior manager,"work-life balance, good atmosphere of teamwork",low salary compare with other Chinese companies in shanghai
357,2,Entry level for years,Game tester,Entry level for profession Mostly great team mates WFH,"Middle job salaries lower than entry level in the sphere. Non-existent raises for three years straight (for everyone except managers). Bonus for the last year will be paid only after 6 month of the next year. Employee can get fired for mentioning the word ""salary"" during call with HR (real case). Higher managers are covering abuse and bullying of lower managers, absolutely no protection for the employees. Employee can and will get retaliation for reporting misconducts, managers and HRs will protect manager, not the worker."
358,1,A Challenging Experience at Ubisoft as a Recent Graduate,Tools programmer,******* ****** ****** ****** ******,"I joined Ubisoft as a Generalist Programmer (Recent Graduate) in 2022, excited about the opportunity to work in the gaming industry and it was a dream to be a part of this company. Initially, everything went smoothly, but I faced unexpected challenges later on. Instead of being assigned to a gameplay developer role as I had hoped, I was placed in the tools programmer team. Nevertheless, I embraced the new role with enthusiasm and gave my best effort. The real struggle began when I realized that my lack of previous experience was a significant obstacle. The team expected me to perform at the same level as seasoned developers and quickly learn complex systems they had developed over 15 years. Despite my dedication and willingness to learn, I faced tremendous pressure to match their expertise. Unfortunately, my senior colleague, instead of offering support and guidance, proved to be unsupportive. Instead of helping me adapt, he advocated for my removal from the team. This was a disheartening experience, as I had hoped for a more collaborative and encouraging work environment. It's important to note that my journey to Ubisoft was not a simple one. I underwent a technical test and interview, demonstrating my capabilities and enthusiasm for the role. However, despite my best efforts, I was ultimately let go, leaving me feeling that my time at Ubisoft was wasted."
359,3,Poor pay,Localization tester,"good environment, smart colleagues, great parties","poor pay, compensations levels too low"
360,4,Crod,Software engineer,"Salary, Time working, Nice people,",They are so strict and i can't progress in this company.
361,4,Heavily depends on your team/project,Game designer,"Some great and talented people all around, interesting challenges and supportive management if you end up in the right team. No massive layoffs.","Ill-designed and mismanaged projects with core teams not up to the task, low salaries, stubborn HQ editorial strategy despite it not really working out."
362,3,Average,Data scientist,good work life balance usually,"Not so fun after a while, games are boring"
363,4,Good Work life balance,Live qa analyst,Flexible work load Good Team,Low salary grade Bad management
364,2,No appraisal this year,Player support agent,Good work Day time shift rotation,No salary appraisal discussion they will just tell you that you are getting 5.5% hike keeping 6% inflation in mind it's seems that salary decission are directly made by project supervisor depending on favorite because others got 10 to 15% with no extra work just there given production. And they hired new agents with up to twice salary
365,2,Amazing colleagues bad studio,Production manager,Great devs that are really experienced.,Upper management that don't really care about their devs
366,4,"Great people, no frills company",Anonymous employee,Coworkers are all friendly and amazing! Health benefits is a plus and you can get a sabbatical after 5 years.,Mediocre work culture after the pandemic. Office could use more amenities and fun events.
367,4,Great Benefits Awesome Teams. Very Streamlined pipeline.,Liveqa specialist,Great benefits! Great Community! Free Coffee,Difficult to move up in the department. Have to side step for career advancement
368,1,"If you are looking for a game testing job, ignore Ubisoft",Game tester,You get to work in a friendly environment,Everything else is very bad
369,4,Great place to work,Anonymous employee,1. Great colleagues 2. Absolutely great work environment 3. Very flexible 4. Interesting projects to work on,1. Not the best salary packages
370,4,Overall good place to work at,Technical artist,- Flexible working - Surrounded by very talented people - You get to work on large projects,"- You dont have much say at how the game is made - Talented people have left the company, titles are very stale"
371,4,Company is good,Game tester,excellent work life balance and overtime paid extra,Less salary hike due to company financial situation
372,5,"Amazing company, loved to work here",Senior software engineer,"Good culture, good management environment, perfect product, lot of freedom",The main issue was with lower salary
373,3,Good for the start,Junior game tester,Good for the start in the industry,"low salary, overall atmosphere in the studio"
374,4,Nice for start,Junior game tester,Team mates Work-life balance Remote work Interesting meetings,Salary The lack of opportunities in the company
375,4,Good company for freshers but pay is very less,Test engineer,Work culture Perks Easy job,Very less pay and growth is also very slow
376,4,ubisoft adventure,Senior digital artist,its great working on triple a titles,the workspace could improve a lot
377,3,Friendly environment,Security analyst,"Good Atmosphere to work, scope to gain more knowledge through courses, team bonding","Min hike, not much to learn"
378,5,Amazing company,Game analyst,"Great perks, fun environment, cool events","salary, no promo pathways, not great leadership team, low stock"
379,2,Too Many Cooks in the Kitchen,Product manager,They have great artwork and you get free games.,There was too much internal politics and posturing. There was no clear direction for the business unit. It was hard to get anything of real value accomplished.
380,5,Very Good Work Culture & Work-Life Balance,Player interaction specialist,Good Compensation Work-life balance Amazing work culture,No cons as such being noticed
381,3,Good experience only for starters,Applications systems administrator,- New Technologies - Experience wide selection of environments,- Not great experience for experienced people - Lots of points to get better in terms of Human relationships
382,1,One of the most heartless companies to work at,Manual qa tester,You will be working on the so called triple a projects that all other companies are salivating at.,"You will be enslaved throughout your work experience, they continually over work us for more than 12 hours a day and force us to post that we only worked for 8 hours on their project management software."
383,5,"Great People, Not So Great Pay",3d artist,Fun People to work with Onboarding is easy,Pay is not that good
384,3,Nice,Intermediate game tester,Gym membership Private parking Flexible program,Small compensation Poor management Bad location
385,4,Good experience despite some issues.,Community manager,"Strong sense of community, great titles to work on and learn from.",Management is not always competent and overall decisions can be complicated to handle internally.
386,3,Good work-life balance. Other benefits are minimal.,Human resources,Good work-life balance. Other benefits are minimal.,"management, salaries, lack of communication"
387,4,A good company that can shine again,Creative director,- Care for employees - Care for players - Strong IPs - Allowed to take risks,- Need to renew with broad success - Still in transition with a lot of new leaders - Lack of autonomy in production teams
388,3,Not an Amazing Experience,Game designer,Work structure can be pretty flexible.,"- In the creative departments at least, the hierarchies can be corrupt, encouraging office politics - French people will get ahead"
389,3,Low pay and political culture but good environment,Senior qa analyst,Good place to learn and grow as your first job Good company environment,Pay is really low organisational politics is bad (you need to cozy up to few chosen ones) Meritocracy and diligence is overlooked
390,5,great place to work,Anonymous employee,"respectful, empowered feelings, great culture and wellbeing focus","benefits can be more here,like insurance"
391,4,"Good place to work, chaotic management",Lead programmer,- The best people you can meet in your career - Diverse and international group of people - Good Work/Life Balance,- Traditional management - Every project suffers from tech debts
392,1,Game tester,Game tester,Only the remote work. Paid overtimes.,"Management, salary ranges, and employee engagement."
393,5,Good company to work for.,Game tester,Amazing Work Life Balance and Work Culture,Less package compared to it's counterpart companies.
394,3,"Nice WLB, low compensation",Online programmer,Nice WLB and work environment,"Inefficient leadership, lots of politics and low compensation compared to market"
395,4,"Fun Gig, but very inconsistent",Demoist,-Get to preview and play brand new in-development games before anyone else -Very fun to interact with guests -Co-workers are friendly and love talking about gaming -Flexible,-Inconsistent scheduling -One week of per month at best
396,4,"Nice culture, lovely people",Narrative designer,Great people with lots of unique personalities,Pay is below industry standard
397,1,The Philippine Studio is extremely bad,Team member,You get to work on AAA games,Do not work here. The salary is abhorrent and working here will be the worst years of your life. You will also have zero work life balance. Avoid this studio at all costs. You will be used for cheap labor.
398,1,an UbiNightmare,Engine programmer - tools,you can work in video game's industry... (I do my best to find a pro),The tool architecture is awful which lead to poor performances for the users and it is a nightmare for the devs to improve this situation. The company seems to hate using standard tools and prefer to reinvent the wheel and do it poorly. So a simple task takes too many time. The worst is that many people working there for years are accustomed to this awful situation so they don't understand the need to improve this. Working there was definitely one of my worst experience in my career.
399,5,Nice people and team to work with,Senior online programmer,Work-life balance Talent team/people to work with,Low pay but for fair reason
400,3,Leisure with a cost,Development tester,Working at Ubisoft is very stress free and are mostly given the freedom to work at your leisure and pace as long as the actual work has been done at the end of the day or deadline.,Abysmal salary for a corporation this large.
401,3,good company culture,Junior game tester,good canteen food friendly culture good salary,only day shift is available
402,4,"Good perks, terrible HR",Development tester,I had an overall positive experience working at Ubisoft. I learned a lot about AAA game development and had very good perks.,"I wanted to grow out of the development tester role and into a dev role, but after 2 years I still had a very dubious path towards that. HR is terrible and every response to your career questions doesn't really answer anything. I also had 3 contract renewals through my 2 years at the company and they waited until the last minute to let me know I would stay employed, which was a great source of anxiety."
403,3,Okay place to work,R&d engineer,Good pay Great culture Flexibility Freedom,Weird work practices Lack of technical management Bad decision making Boring projects
404,5,Great Experience,Level designer,"Great projects, amazing colleagues, great opportunity to grow",Low Salary and Benefits and overall salary increase.
405,3,Nice company with good job security within industry,Global brand director,Job security (vs other game companies) Working on cool games Good and friendly culture since a few years,"Heavy politics between studios, HQ and Publishing Teams"
406,4,"Many good, some bad things",Anonymous employee,"job security, friendly work environment, great games, worldwide network","sub-standard payments, (large-scale productions), really de-humanized HR department"
407,5,Enjoyed my time!,Marketing coordinator,"Lots of great people, training budgets, allowed flexible working.",wouldve been great to work in other ubisoft studios globally to learn from others working in different projects
408,4,Less efficient that it could be,Programmer,Very good team family-like atmosphere,not high salary overtimes and crunches
409,5,Sydney office is great to work for,Senior software engineer,"Full remote work, great company culture, really talented colleagues, interesting and ambitious work","It's a huge company with all of the usual company requirements to cross the Ts and dot the Is. Way too many meetings, but direct management really try to minimise and eliminate useless meetings"
410,4,Good,Game tester,Good env and time managemen,None if you want peaceful env
411,1,Big No No,Senior game tester,Good work environment and nice people.,Not recommending you this company.
412,5,Good,Junior game tester,Work life balance Flexible Breakfast,Low salary Too much comfort
413,4,Good company,Data scientist,Open to communication. Space to try new things,Salary is relatively not so competitive
414,4,Good,Game tester,It is a good place to work,No cons as such other than salary
415,5,Best Workspace,Tester,Good Colleagues Knowledge Standard Processes,Nothing comes in mind at the moment
416,4,Good work culture,Game tester,Good Work culture and Job security,No cons to share for
417,3,Poor conpany,Game tester,-Easy tasks -possibility to promote,-Low salary -No professional develpoment.
418,3,Struggling Family Business,Senior developer analyst,Relaxed atmosphere (in IT) Gaming Culture Work-life balance Used to have a strong benefits package,Struggling financially due to delayed releases Work policy starting to shift Bad managerial decisions are costly and end up in downsizing and benefit slicing to cut costs
419,3,Tester,Quality assurance,Friendly environment with fellow testers,Not so friendly environment when talking about Leads
420,4,it does what it says,Animation technician,"makes great porfolio, not a sweat shop overall.","rigid workflows, you're generally expected to fall in lines and stick with the ancient old pipeline."
421,4,"Good exposure, niche work exposure and underpaid labour",Junior programmer,In the right project you get to interact with and learn from a very diverse set of people internationally. If you are lucky to be put into an exciting project you'll get to work on plenty of challenging and interesting tasks. They have a lenient vacation policy so people usually have good work life balance.,"As compared to the work that you are asked to deliver, they severely underpay their employees."
422,5,Best 10 years of my career,Team lead,"Smart people everywhere Lots of ressources , training Kick-ass internal mobility",Focus on their main IP :(
423,5,All good,Financial analyst,Great work environment and great atmosphere,Constant changes and low stability
424,4,Great community but a company a little bit too big,Junior game designer,"Tons of talented people, and some good advantages",Pay in production is low and promotions are slow
425,3,Low salary as compared to other studios,Senior game tester,Great working environment and helpful colluegues,Low salary range offered by company
426,4,Procurement Specialist at Ubisoft,Procurement specialist,Great company values Awesome co-workers Good life-work balance,Low compensation Poor Upper Management
427,3,Ubisoft Salary,User research analyst,Great benefits Good colleagues Great work life balance,No opportunities to grow Seniority is ignore and opportunities seem to be given randomly for no rhyme or reason Management have no idea what they doing
428,2,Disappointing,Developer,Flexible on working remote and a bit on schedule Good vacation quantity with seniority,Low salary No clear career path Hired with a generic title while being forced into a separate unwanted specialist role Layers upon layers of management and non technical roles making up deadlines and pressuring the ground floor without consulting them Company events at questionably hard to reach places. Encouraged to go to company events on weekend on your own time Large codebase with no effort for standardization and too many cooks in the kitchen
429,4,"Great benefits, limited growh",It business analyst,Great benefits -vacations -summer half day off on Friday,- Low rrsp - Limited growth
430,4,Friendly but slow growth,Junior game tester,Friendly environment Supportive team Work life balance,Slow growth Pay is slightly less than market standards
431,4,Best gaming company in Pune,Senior game tester/tester iii,Work life balance Awesome people Enjoyable work,Slow growth for higher position
432,3,"A lot of good things, unfortunately a lot of bad things",Game tester,It's a good company to learn and develop your basic skills.,"low salaries, low carrier opportunities, top management should be changed, decisions they make are awful"
433,4,"Huge company, lots of opportunities.",It team lead,"always options for inter company movement. lots of products, so always an option to work on a big game good work life balance (especially in the summer) i worked in a great team and had great colleagues.","huge company means it's easy to be comfortable. lots of people who have been in the same positions for several years, because they can. some toxicity in certain teams (much better than it was), different teams are developing overlapping products so there can be a lack of collaboration. not leaders in terms of salaries or benefits. global teams can add unfavourable meeting times."
434,3,ok place to work,Product manager,nice companies events nice office,lack of innovation plays it safe
435,3,Good workforce let down by incompetent management.,Anonymous employee,"Great colleagues, diverse and talented workforce, nice offices. You will gain new skills and enjoy your working environment.","Pay is decent but won't keep up with inflation, entrenched culture of working unpaid overtime, upper management is at best out-of-touch. Be prepared to work on trend-chasing projects that will be irrelevant long before they can be completed, with colleagues that only shared 1-2 hours of timezone with you."
436,3,Decent,Qc tester,The people are nice and the atmosphere pleasant.,Hard to level up and grow work-wise.
437,5,Ubisoft feedback,Network administrator,Benefits Investment into Personnel Training Internal promotion,Red tape and Frequent Meetings
438,4,Nice Company to work,Lead/senior 3d artist,"Nice company to work as a 3d artist, really good work-life balance and future growth.",Not much Just HR department is a bit slow.
439,3,Ubisoft Pune,Game tester,Great work environment and culture,"Overall low compensation compare to other companies,"
440,5,salary title,Quality assurance analyst,"Good bonus, work life balance, Good team, New things to learn","If you are the one who is more into relaxed work then do not work. If you are anyone who loves smart work join here,"
441,3,bad,Quality control,"Good as a job for someone at the start of the road, you can learn a lot about the industry","low salary, bad managers, bad comunication between departments"
442,4,Ubisoft,Senior qa tester,Working environment is very pleasant,Some people can be toxic
443,4,There are no positives outcomes to working hard,Online programmer,People are very nice to work with.,Force return to 40% work in the office. No benefits to working hard in terms of compensation.
444,2,Low compensation,Account support,Hybrid model and Office culture,Low compensation No growth feels Stagnant
