Position,Rating,Review Title,Role,Pros,Cons
445,2,Hard Ceiling if you're not French,Associate producer,"Great Talent, large projects, a lot of experience and expertise to learn from and contribute to","If you are not French or Canadian, there's a hard cap to what you can achieve (for most). Although English is the studio language, important discussions often devolve into French, leaving a lot of people that should have a say out in the cold. While there are some of the greatest people I ever worked with at Ubi, there are also a lot of the worst. Office politics, cliques and favoritism run rampant, and once you find yourself on the bad side of a superior you might as well resign, because it won't get better. Another thing I hated was the performance reviews : by company directive, a portion of your team (10-20%) HAD to be evaluated as below average and given a performance plan to improve. No matter how good the team as a whole was, or if there was anyone that actually underperformed. Sam was true for overperformers - only a few were allowed to be considered above average and only a handful in the entire studio were allowed to be given exceptional reviews. All, off course, to keep the salary raises in check for a company not known to pay competitive in the first place..."
446,3,Junior Game Tester,Junior game tester,Nice team Private health care,low salary lack of development
447,3,Good company with great people,Manager,Good people to work with and learn from Exciting work environment Fast paced,High turnover Projects have been struggling New management
448,3,Good but there are valid shortcomings,Web developer,- Access to a decent gym for free - Lots of good organized sports and health activities are always available - Entertaining bi-annual events that bring the company together - High job security - Good team (but depends on luck). My first team had a horrible manager - insecure and a control freak.,- uncompetitive pay (they know it but always deny it) - many have left due to this - Failure to get rid of underperforming workers - heard many complaints from others about this. They will shift you between teams for underperformance. But they don't get rid of people - unless you did something immoral - Remote work not possible outside of Canada
449,3,Fantastic,Anonymous employee,Great experience for work and life,Great promoting chances offered here
450,3,Sounds better than it is,Game animator,Good people to work with. Great experience working on AAA games,"Very corporate. A lot of meetings. A lot of talk about how luck you are to work there etc. It is very hard to move up levels (in order to get a raise) Bonuses are not guaranteed, and they are based on the length of time you worked at the studio and on the project."
451,3,Not the best time to join,Marketing specialist,Creative environment with amazing office,"Downfall of the company, no raise, budget control, no travels"
452,4,"Great people, great opportunities, bad pay",Security,"Lots of great people, lots of ideas and incredible amount of opportunities that can help you develop your expertise, may these be internal or with external partners. Relaxed environment (for what gaming industry can be), never asked extra unpaid hours (crunch) but did happen. Cooperativity to the stars for the majority of the teams.","Low pay, stagnant ""Ubisoft formula"" mentality from higher management in game design. Lots of people can bring lots of disorganized structure and mandates. Higher management is not accountable, benefits do not respect the lead of work that is dumped on the shoulders of lower stakeholders. No respect for employees' effort and tedious career development almost created to avoid internal mobility. Bleeding talent left and right due to higher management unclear goals, only to set these as high as possible and not adding velocity or facilitate transitions."
453,4,Ubi Shanghai Studio,Sales manager,Work life balance Good employee benefit,Salary not as competitive as other companies in this industry
454,4,Game development and testing company,Junior game tester,Good workplace to work with QC teams,Lower pays as compared to same industry
455,4,Stable job,Senior level designer,"Ubisoft Bucharest is a very stable studio. If you work well and are willing to learn, you will be able to do great.",Lower than average salaries can feel a bit unfair at times.
456,3,Going downhill,Associate director,Benefits are very good for employee's,Super political between teams to the detriment of making progress Direction company has taken is no longer customer centric Compensation is not amazing and others in similar roles can be paid significantly more
457,4,Great opportunity for freshers,Qa engineer,Ubisoft can indeed be a great opportunity for freshers looking to start their careers in the gaming industry.,"Career advancement within Ubisoft can be slow, especially for entry-level positions."
458,4,Good office culture,Anonymous employee,"open-minded office culture, wide social networking opportunities","diffficult to get promoted, intransparent HR policies"
459,5,Experience,Ceo-founder,good pay when it comes to qualiry,lots of work for the amount od structure
460,2,"no good, avoid",Junior vfx artist,i guess its a big company... so yea,bad pay in france they dont speak english even tho they hire people from other countries. consequence of this is you are isolated and avoided
461,4,Good company with lots of benefits,Junior 3d artist,"Triple A projects, fun workmates, good culture, etc",Improve more on training and onboarding new people
462,4,Nice environment,Engineer,Gaming Culture Environment Fun Activities,Limited career opportunities Salaries bellow market
463,3,Great working there,Live operations coordinator,Great environment and people and lovely projects,Difficulties to build a career
464,4,Good workplace,Data analyst,Great enviroment to work at,No transperancy on promotions or career growth
465,2,Depressing,Technical artist,"Good office location, easy to go to with public transport. Good onboarding process.","Unengaging job, bad engine, office drama, crazy HR, boss sucks. Pay not great."
466,4,Work experience,Anonymous employee,"Work life balance, hybrid, over 25 vacation.","a little low salary, other is ok"
467,4,Senior QA tester,Senior qa tester,Friendly people and fun for a first job,Very hard to grow inside company outside the department; despite internally promoting growth
468,4,Nice place to work,Tech artist,Good people that mostly focused on the games and not politics,Return to office 3 days a week
469,3,a good comapny to work,Permit technician/purchasing,"advantages, creativity, atmosphere, location, size of the company","Micromanagement, reduced benefits, loss of sense of belonging, reduced HR support,"
470,4,Collaborative Team Dynamics Amidst Ongoing Organizational Evolution,Anonymous employee,"I am fortunate to work with a great group of people, fostering a collaborative and enjoyable work environment.","The organizational structure currently presents challenges, but it's noteworthy that efforts are underway to address and improve this aspect."
471,3,Great job as a student,Qa tester ii,"nice collective, meal vouchers for a cantina, free games before launch, great place to earn some money as a student",not everybody see this a long-term career building
472,4,Great place to work,Associate producer,Great team spirit but depends on the studio. One if free to try and fail as long as lessons are learned and applied next time.,The games could be better if it wasn't for the invention of fiscal years
473,4,Ubisoft,Jr. game tester,great working atmosphere and friendly team members,I did not have a project for a month
474,4,Great Company,Security researcher,Interesting and challenging targets. The management is considering and prioritize your well being. Compensation is good. Remote work.,Hard to do anything non-conventional.
475,5,Ubisoft - Programmer,Programmer,Employee Friendly Good Work - Life balance Good Opportunities to learn,Growth is very Slow. Rest everything is fine
476,3,Good company,Software developer,"Good work life balance, some benefits also","Salaries low, too much management levels"
477,4,"Good Environment and Benefits, Slow moving management",Generalist programmer,Good Benefits Excellent Colleagues Interesting Tech Well Known Projects Diversified career opportunities,"Large Company can be slow moving Too much management, not enough focus on the actual delivery"
478,5,Salary ubisoft,3d artist,Good team good work time good salary,no cons what so ever
479,4,Purchasing Specialist at Ubisoft,Purchasing specialist,"I work for HQ, and this is great",Small salaries comparing to the market
480,2,"Great colleagues, toxic upper management",Anonymous employee,"Some great people there, all suffering from poor leadership",Upper management out of touch with reality. Toxic HR behaviour
481,2,The company is more focused on infrastructure rather than employee satisfaction or competitive salaries,Team leader,Good Infrastructure Cafeteria Yearly party Goodies Fun activities,Not competitive salary No HR involvement Rare stakeholders meetings Was usually asked to extend shifts No career growth
482,3,Best place to work,Game tester,Healthy environment Productive work culture,every company has some cons
483,3,It's fine,Gameplay programmer,"Decent benefits, and the environment is fine",Pay is awful and there are no plans to fix it
484,3,"nice people, good work life balance",Associate producer,"a lot of young people, nice vibes. good work life balance.",salary could be more ...
485,5,Internship Salary,Internship,"Great culture, great colleagues, great offices, great location, great responsibilities.","None, none, none, none, none."
486,5,Great place to work,Software engineer,Good benefits and decent workload,Lack of communication and visibility
487,4,Good company,Lead ui designer,Good benefits for full time employees,Lack of organisation on certain projects
488,4,Overall good,Art director,"Good work life balance, nice perks",Pay could be more competitive
489,4,Good Company to work,Technical artist,- good work culture - salary on time - career development opportunities,nothing as such as of now.
490,4,Pay,Health and wellness coordinator,- work life balance - flexibility,- Nothing to add at the moment
491,3,growth is slow but there is work life balance.,Senior concept artist,Its a stepping stone to ones art career. After you have experience you can easily maintain work life balance. You have a safety net even if your project is done and move over to others based on the your skillset.,Growth is slow financially since recession is in full swing.
492,4,Awesome workplace environment,Game tester,People are very nice and have very chill attitude.,Not much growth opportunities. Career options are limited unless you want to spend off work time to learn other skills.
493,5,Pros and cons,Programmer,One of the best culture.,Not applicable - No cons
494,4,...,Senior lead,Teams with skills and passion.,More comments will come later.
495,4,I liked,Computer programmer,"Good pay, benefits and awesome projects","bad pay, no benefits and terrible projects"
496,4,Good Environment,Senior ui designer,The company cares for peoples well being and development. I enjoy working for the company and studio.,Pay is not competitive enough to want to stay for much longer
497,4,"Good company, exciting challenges",Ux designer,-People are Amazing - Projects are challenging - life/work balance is good,- Low salary -not enough courage to deliver
498,4,Great place to work,Qa engineer,work life balance fun to work in a gaming comapany,Slow growth for new joiners
499,3,Good Company to Work for on Your Way to a Better Company.,Composer,Good work/life balance. Awesome people. Creatively satisfying work.,Little upward mobility or emphasis on career development. Creative direction was insular and exclusionary. Producers too focused on project deadlines without a real understanding of how to assess the quality of their product.
500,4,Ubisoft,Concept artist,"Good support, management, medical insurance, cool office.","Sometimes boring projects, not very big salary"
501,5,Internship Salary,Internship,"Great culture, great colleagues, great offices, great location, great responsibilities.","None, none, none, none, none."
502,5,Great place to work,Software engineer,Good benefits and decent workload,Lack of communication and visibility
503,4,Good company,Lead ui designer,Good benefits for full time employees,Lack of organisation on certain projects
504,4,Overall good,Art director,"Good work life balance, nice perks",Pay could be more competitive
505,4,Good Company to work,Technical artist,"- good work culture
- salary on time
- career development opportunities",nothing as such as of now.
506,3,growth is slow but there is work life balance.,Senior concept artist,Its a stepping stone to ones art career. After you have experience you can easily maintain work life balance. You have a safety net even if your project is done and move over to others based on the your skillset.,Growth is slow financially since recession is in full swing.
507,4,Pay,Health and wellness coordinator,"- work life balance
- flexibility",- Nothing to add at the moment
508,4,Awesome workplace environment,Game tester,People are very nice and have very chill attitude.,Not much growth opportunities. Career options are limited unless you want to spend off work time to learn other skills.
509,4,...,Senior lead,Teams with skills and passion.,More comments will come later.
510,5,Pros and cons,Programmer,One of the best culture.,Not applicable - No cons
511,4,I liked,Computer programmer,"Good pay, benefits and awesome projects","bad pay, no benefits and terrible projects"
512,4,Good Environment,Senior ui designer,The company cares for peoples well being and development. I enjoy working for the company and studio.,Pay is not competitive enough to want to stay for much longer
513,4,"Good company, exciting challenges",Ux designer,-People are Amazing - Projects are challenging - life/work balance is good,- Low salary -not enough courage to deliver
514,3,Good Company to Work for on Your Way to a Better Company.,Composer,Good work/life balance. Awesome people. Creatively satisfying work.,Little upward mobility or emphasis on career development. Creative direction was insular and exclusionary. Producers too focused on project deadlines without a real understanding of how to assess the quality of their product.
515,4,Great place to work,Qa engineer,"work life balance
fun to work in a gaming comapany",Slow growth for new joiners
516,5,Great,Senior ui artist,"cool people and projects, work life balance","hesitance about innovation, mediocre management"
517,4,Ubisoft,Concept artist,"Good support, management, medical insurance, cool office.","Sometimes boring projects, not very big salary"
518,5,Good company to work,Qa - game tester,Work culture is very good,"Nothing, Everything is good, nothing to worry about."
519,3,Gaming is boring,Game tester,It's good for the gaming freaks,Very low salary for the employees
520,4,Interesting projects,Project coordinator,"- diverse Projects
- Creative environment
- Global Presence","- work-life balance
- compensation"
521,2,Stay away,Anonymous employee,Used to be a great place until current MD Olga joined the studio,Current MD is unprofessional and bullies those who donâ€™t agree with her
522,5,it's okay,Gameplay programmer,great working environment and people,i really don't know but i think salary
523,3,Good company,Hr director,Ubisoft is one of a kind gamedev,There are numerous political issues
524,4,"Friendly place, low compensation, little to no crunch",Assistant technical director,"Very friendly environment and colleagues. Never worked crunch once, even during the closing months of projects. Lots of protections to ensure you're never forced to work overtime. Great parties and employee events. Get to learn French with a private tutor 1:1, on company time. Generous WFH policy, at least in some offices.","It's not really an industry secret at this point that Ubi does not pay well. Annual reviews do not keep pace with inflation at all. If you are technically proficient, you will get leaned on pretty hard. The language. Everyone knows English and can use it well, but if you really want to advance, you need to make an effort to speak French. Have to fight tooth and nail for promotions at times."
525,4,Solid,Software developer,You can work on cool projects and the team is good.,"Low pay, management don't know what they are doing sometimes. You cant make higher management to listen,there mechanisms but they are not working"
526,2,The company has lost its way.,Gameplay programmer,"Some good people and decent productions. Pay is comparable to competition, though slightly behind. Vacation time is fairly standard. Flex days and unlimited sick days are a big plus.","Turnover is getting out of hand. Many seniors have left, remaining seniors are spread too thin. Serial harassers are shuffled around instead of being dealt with. Company will change policy on a whim to suit their narratives. Studio management is showing that when it comes down to it, they will go for bullet points that will please investors in the short term over the well-being of employees every time."
527,4,.,User researcher,Opportunity for work life balance,Low salaries to compare with market
528,4,Good,Anonymous employee,Gaming company is best choice,Need to add high grafics
529,3,A hard truth,Anonymous employee,- some teams are supportive/amazing - individuals are talented & hardworking - creative individuals - can find some supportive managers - average incentive offerings/insurance,"- total lack of respect toward employees from studio/business leaders - embarrassing - salary is not competitive - mentality is that it's a privilege to work here (it's not) - experience is heavily dependent on your team - no longer a flexible remote work situation - stable, for now"
530,4,A lovely Experience,Assistant director of finance,A welcoming environment that can be both informal and friendly and formal and serious,Lower pay than expected for my title
531,5,i am best for over company,Game tester,"Passion for Gaming: If you have a deep love for video games and the gaming industry, Ubisoft provides an opportunity to work in a company that is a major player in the global gaming market. Diverse Portfolio: Ubisoft is known for producing a wide variety of games, from action-adventure and first-person shooters to simulation and strategy games. This diversity can be appealing for individuals with different gaming interests. Global Presence: Ubisoft is a multinational company with offices and studios around the world. Working for a globally recognized company can provide opportunities for international collaboration and exposure.","Working at Ubisoft, like any other large company, can have both positive and negative aspects. It's important to note that individual experiences may vary, and these downsides might not be universally applicable to all employees. As of my last knowledge update in September 2021, here are some potential downsides that have been reported or speculated: Crunch Culture: The video game industry, in general, has faced criticism for a culture of crunch, where employees are expected to work long hours, often leading to burnout. This has been a concern at Ubisoft as well, and the company has faced allegations of a toxic work environment. Work-Life Balance: Related to the crunch culture, maintaining a healthy work-life balance can be challenging in the gaming industry. Long hours and tight deadlines might impact personal time and well-being. Management Issues: Some former employees have reported dissatisfaction with management practices, claiming that decisions and communication within the company could be improved. There have been concerns about transparency and decision-making processes. Stagnation in Creativity: In a large organization like Ubisoft, there might be a perception among some employees that there is less room for individual creativity and innovation. The company's size and structure could potentially stifle the creative process for some. Project Cancellations and Restructuring: The video game industry is known for its project cancellations and restructuring. Employees may find themselves working on a project that gets canceled, leading to uncertainty about their roles and job security. Office Politics: Like any large corporation, Ubisoft may have its share of office politics, which can affect work dynamics and career advancement. Navigating these politics can be challenging for some employees. Salary and Compensation: While this might not be universally applicable, some employees may feel that their compensation doesn't adequately reflect the demands and expectations of their roles, especially considering the competitive nature of the industry. Diversity and Inclusion Concerns: Ubisoft has faced criticism for its handling of diversity and inclusion issues. Allegations of a toxic workplace culture and incidents of harassment have raised concerns about the company's commitment to creating an inclusive environment."
532,1,"good place to ship titles, Pay is horrible, too many managers that do not understand game development",Senior texture artist,"- easy to ship game -easy to move from junior to senior in short period of time, I seen cases of Juniors becoming leads in 2-3 years by getting on the good side of producers/directors etc","Compensation is terrible, You can get promoted easy but the pay will not adjust to what you should be earning for that role"
533,2,Need to be updated - Non inclusive work culture,Anonymous employee,- branding ( but too much bullsh**t) - technical challenges - depending on your team work/life balance - remote work / 5 weeks vacations + 1 week,- low salary grid - lack of good management - some people are here from too long and are valued just by being around or sitting around. Feel like some people are hired to do the work besides others are just here for faking. - lack of transparency & objectivity with the annual review performance system. - you have to fit in their system and don't think outside the box to work peacefully and fit their work place culture.
534,1,Strongly avoid,Product owner,Possibility of remote work within France.,"Huge workload for some people, non-functional team, poor working atmosphere due to dysfunctional management."
535,5,Great company,Senior unity developer,"Best mobile projects on the market.
Strongest teams.","Pretty low salaries.
Long processes."
536,5,I love it,Gameplay programmer,Good environment for growing and very respected as an employee,Working on a big titles may prevent you from touching more systems as the game is huge.
537,5,Great company with great culture,Hr manager,"Great colleagues, good benefits & salary",Nothing to say as everything was great
538,4,Nice place to work,Data engineer,Nice place to work at this office,Not too much to add here
539,5,Lol,Developer/tester,"Friendly
Good lead
Feel encouraged
Lot of fun
Best employer","None 1
None 2
None 4
None 3
None 5"
540,2,Stay away.,Brand manager,Best co-workers and not much else.,"Awful structure, Leadership and HR not nice and only think about their own skin."
541,4,Easy work and low pay,Gaming support agent,Easy work responsibilities and repetitive cases,"Low salary and keeps on changing in terms of processes, policies, and no solid management firmness"
542,5,Programmer,Online programmer,"The company is a well-known and successful game development studio, with many popular franchises such as Assassin's Creed, Far Cry, and Tom Clancy's Rainbow Six. Ubisoft offers a creative and collaborative work environment, with opportunities for employees to work on a variety of projects and to contribute to the development of new ideas. The company has a strong emphasis on diversity and inclusion, with a number of initiatives in place to support and promote diversity in the workplace. Ubisoft offers a range of benefits to employees, including health insurance, retirement savings plans, and paid time off. The company has a number of locations around the world, offering employees the opportunity to work in different countries and cultures.","The company is known for its demanding work schedule, with long hours and tight deadlines common in the game development industry. Some employees have reported issues with management and a lack of communication within the company. The company has faced criticism and controversy over its treatment of employees, particularly with regards to working conditions and crunch time. Some employees may find the pace of work and the constant need to adapt to new technologies and trends to be challenging. The company has a strong emphasis on expanding its business, this may lead to a change in strategies, which may affect the job stability and security of some employees."
543,2,Poor HR and project management,Product marketing manager,Can work for AAA franchises,"Sudden big layoffs, poor internal and HQ communications and organizational structure"
544,4,Nice place to work at,Buyer,"Work-life balance, 6 weeks of holiday.",Work in office 2x per week.
545,1,Very poor leadership,Project manager,It is a good place to start a career. The people are great to work with.,"The leads, lower management and HR team are young and inexperienced. They cannot make their senior people grow and are very bad at making their employees feel valued, which is justified very sadly by the fact that they are Â«Â a horizontal company where everyone is equalÂ Â». So not a great place for achievers. Plus, the company makes poor decisions that they are not able to justify and do not care about their employees anymore (Â«Â if your are not happy, just leave!Â Â»). The company has changed a lot in recent years, and not in a good way"
