Position,Rating,Review Title,Role,Pros,Cons
761,5,"Ubisoft Reflections - Welcoming, diverse, fun",Lead programmer,"â€¢ Well looked after, free cold food all year round, free hot over winter â€¢ Subsidised travel, gym memberships, private healthcare, etc - loads of perks â€¢ Company funded social events â€¢ Wellbeing ambassadors, cosy kitchens, breakout areas, semi-private spaces and meeting rooms â€¢ Hybrid working style with no fixed pattern but heading to a mandatory but flexible 8 days â€¢ per month in the studios â€¢ No crunch â€¢ Super discounted games orders â€¢ Well structured, generally well organised, with good & fair career progression structure â€¢ Friendly atmosphere â€¢ Can simply request to transfer between Leamington and Newcastle as your home studio â€¢ Can internally apply for other jobs in Ubisoft worldwide â€¢ A mix of big project work and tech teams available to join (though the latter mostly restricted to programmers) â€¢ Occasional travel between two studios (though definitely less of this lately)","â€¢ Experiences vary between teams and projects! I seem to be in one of the better teams. â€¢ Average pay â€¢ Not offering full-time remote working (in case that's what you're looking for) apart from exceptional cases (ie they are desperate) â€¢ Despite great improvements in communication, can still be a lack of clarity on certain subjects (especially pay and higher career development) â€¢ Staff turnover currently a little high, struggling to retain staff, but without greater industry context I don't know if this is Ubi specific or currently an industry wide issue while people settle after Covid (and the plethora of fully-remote roles now available). â€¢ Projects developed using a lot of co-dev with other studios reduces human interaction, team feel, plus different time zones reduce window of communication â€¢ Bonus scheme linked to company profitability is understandable but the past couple of years have not been so great, so reduced or no bonuses being paid out"
762,4,A positive place to work but that lacks ambition,Business development manager,"+ friendly & diverse work environment (working with people from different studios across the world, with radically different expertises...) + as a french person living in paris, it feels great to be close from the decision center of an entertainment giant (won't be the same if you work for a US giant from france, in terms of impact) + at the forefront of the tech industry","- a risk averse company (justified by the evolution of the market: projects are more expansive in time, $$$ & people, so mistakes are expansive) - too many ""dinosaurs"" comfortably sitting at top spots without the will to fight to make things evolve"
763,4,Nice to work at but not long term.,3d artist,Proper guidance in your career growth. You get to work with great people who can be friends. Toxicity is not tolerated.,Diminishing return the longer your tenure is in terms of salary.
764,4,Good place to work for data specialists,Game intelligence analyst,Good salaries and work conditions,Conflicting management priorities makes things difficult sometimes
765,4,Game security Engineering,Game security engineer,Fun environnement Motivating Flexible International,Low salary Low compensation No stock options
766,1,"Low pay, negative environment",Backend developer,the ubisoft clinic and the Friday half day summer hours,"Environment, pay, mismanagement, budget issues."
767,5,Great place to work,Senior hrbp,"Culture,teams, management,hybrid work model, opportunities",Nothing in specific as in cons
768,4,"Good company, Average pay",Technical artist,- Inclusive environment - Multicultural team - Awesome colleagues - Local Management also rocks !,- It's complicated. The studio is part of a bigger corp. and here things get .. corpo. - Payment is below average for the location and tech segment - Forcing presence in the office raises life costs which actually decreases your income.
769,4,More money,Quality control,Good place to grow in a company,The salary is a joke for someone who actually live in 2023
770,5,Great company,Game developer,Many benefits like good Offices ando good salary,Good amount of work in Game programming
771,5,Excellent place to work,Anonymous employee,"The working day can be long hours, but there is minimal pressure on us to achieve our targets which most colleagues can do with ease. There is a lot of room for progression if you work hard and have a positive attitude, you will be asked to collaborate on many projects with different teams throughout the company. We get to see from the frontlines issues players are experiencing with some of our games and we are able to report them to our QA teams who can usually resolve these issues with updates and patches. You feel like you are making a difference and helping to improve the overall gaming experience for players.","Compared to similar positions at other game companies, our salary is less. Certain individuals I work with who are in the same position as myself can be very toxic to work with, but with all the changes that have been made recently in the company, these individuals are being noted and having their benefits taken away from them as well as receiving disciplinary after being reported by other team members. I believe as a whole, we all want these types of individuals to be removed from the company for good, instead of receiving warnings, but hopefully, this will continue to improve as time goes on. No matter which industry you work in, there is always that one bad egg, unfortunately, that cause other employees some upset and makes the working day more difficult."
772,5,It s nice,Game tester,Good working space and coworkers,Nothing really everything it s great
773,3,Decent,Gameplay programmer,OK working environment Different titles you can work on,Aimless work sometimes Salary Lack of honesty regarding project status
774,3,"Okay to get experience, get out of there once you feel confident",Community manager,The people and the stimulating environment,"HR is garbage, salary is way below industry standards, forced to work hybrid, forced to move country to advance in the career"
775,4,Amazing Company,Anonymous employee,the environment is friendly work life balance good opportunity to learn as a junior,low salary and difficult to be promote as a senior
776,1,Hated the company,Chef,Nothing to highlight except that some people are really nice to work with,Management is basically -> If you have friends  promotion
777,4,Great work culture,Game tester,Good Work Culture Good recognitions Time flexibility,Slow Growth Minimal Salary Increasing toxicity
778,1,Worst,Game tester,The salary is very bad,Nothing to share here so
779,5,Great employer,Ai programmer,Good benefits and many social events,Not enough experience to tell
780,4,Good,Human resource intern,Free Breakfast ðŸ˜‚ Great work Place Great Experience,Work Life Balance Work Load
781,4,great place to work at,Developer,good benefits health care interesting work,a lot of changes in the teams
782,1,Art Director can't even do art properly.,3d artist,"If you are a fresh graduate, its nice to work here for experience. But after 2-3 years just leave. management doesn't know what to do because there's not enough budget to scale the business. the business model of the studio is to exploit fresh grads.","Art director cant lead by example. You'll be welcomed by a burnt out team. Studio location is in the middle of nowhere. Mode of transportation is only company shuttle(free) if you miss that, you are screwed. A ton more cons. lets just start with these 3."
783,5,Great place to work,Concept artist,It had an inclusive company culture.,The direction could have been better.
784,4,Work Culture,Anonymous employee,Good work culture. Respect people value,Salary is low as per market
785,4,Great company but low compensations,Development tester,Good work life balance and positive workplace Exciting projects and fun work Decent benefits and time off package,Low compensations/salaries Very little room for career growth
786,3,Nice company but very limited opportunities,Senior web developer,- Excellent in work life balance - no work pressure at all. - Nice working atmosphere.,- Very limited opportunities. It's very hard to promote. - Salary scale is very poor. - Can't get opportunity to switch in other technologies.
787,5,Good work,Anonymous employee,Good Workplace Solid Location Great,Salary Time Opportunities Benefits Learning
788,4,"Positive environment, less competitive pay",Programmer,"Wholesome and fun environment, supportive teams, interesting work",Less competitive pay compared to other gaming companies and studios
789,5,Perfect recruitment process,Senior product manager,"Ubisoft did an amazing job during the recruitment process on all aspects: transparency, follow-up, clarity. Diversity and inclusion is at the core of the company culture",None on my point of view
790,2,"Ubisoft - a place to start, not to stay",Quality assurance,"Constant push to learn new things, try new things",Pay increase feels minimal to their increasing demands
791,5,Marketing leader with extensive experience in the media and gaming industry,Marketing director,"Games, marketing campaigns, employees management etc.","Making profits, management, creative side, etc."
792,5,Awesome culture!,Ai programmer,Nice culture and treat. Interesting projects and generally okay salary.,"Too much bureaucracy, slow development due to this"
793,4,Great Internship,Data analyst intern,"Work environment is great, teams are passionate.",Lack of dialogue between studios.
794,4,Good company with opportunities,Ui programmer,"- It's easy to create ourselves opportunities in Ubisoft and evolve in our career - Nice company culture with a lot of events and stuff that makes working actually fun - Good salary overall even if not amongst the best ones on the market - Since the scandals that took place a few years ago, Ubisoft really worked on making the company being a good and inclusive place",project managements seem to be unaware of what actually happens on the field and sometimes their Decisions seems to make no sense
795,5,Best company for freshers and Gamers,Qa - game tester,Very Nice management System always help you to grow.,"Nothing , everything is good"
796,4,Manager,Manager,Lots of internal opportunities to learn and experiment,Loads of inefficiencies and strong french business culture
797,5,Best company,Test analyst,"Best work environment ,best leads and teammates","No cons ,juz salary is low"
798,2,Cheap and asks for a lot,Ui programmer,"After transitioning over from the tech industry this was my first job in the games industry. They offered me a level 2 position and allowed me to spend some time upfront learning the ropes. Some of the benefits were also pretty good, particularly 6 weeks of vacation, an onsite medical clinic, and personal trainers at the company gym. And I guess it's a plus that I was never asked to crunch (live game).","The technical onboarding consists of being sent a giant folder of links to documentation that is old and often wrong. Finding the right way to run the development environment and debug Ubisoft's internal tools was challenging, and since I didn't come in as a level 1, at some point their patience abruptly ran out. Apparently a learning curve is not tolerated if it's not your first job out of university. I eventually did find a solid rhythm for completing tasks, but I was frequently criticized by my manager for asking questions (not ""help I don't know anything solve this for me"" questions, more like ""I've diagnosed the issue and found a potential solution, but I'd like your opinion on my approach before wasting time implementing code that will get rejected in review"" questions). So I was submitting quality code that was OK'd quickly by fellow programmers, but put on my manager's shitlist because I wasn't enough of a lone wolf. It's the total opposite of most work environments I've been in, very weird. I have to add that on top of this frustrating work experience, the compensation was below industry standard (although better than before for new hires it seems), and the company tended to have a cheap attitude about many things, compared to other companies where I've worked. Expect to pay yourself for things that you might have expected to be covered at other jobs (coffee, cutlery, transportation to special company events). Also expect regular ads in your work email for you to buy stuff from your employer, like you're a customer, not an employee."
799,4,Great Internship,Data analyst intern,"Work environment, teams are passionate",Lack of dialogue between studios
800,3,Life as junior 3D Artist,Junior 3d artist,Good work experience for newly graduated students. AAA game project exposure. Great for your work portfolio.,"Company has bad Office Politics. The Culture is so woke you can't even talk freely, cuz you might offend someone. No Overtime Pay"
801,3,Ok company but still has some work to do...,Lead sound designer,- Culture is improving - Nice Studio in Montreal - Work from home,"- Salary a little below industry, bonus are rare. - Not possible to work remotely from another country a few months per year. - Too many managers and too much iterations on project. - No studio Bonus for employees since Pandemic. - Old engines and not open to partnerships (for instance with Unreal to improve their tech and stay modern). - Game franchise are getting old, they surf on their well known franchise/remakes which can become a little boring."
802,1,"Promising opportunities, but need to address team dynamics and autonomy freedom",User researcher,- Real opportunity to contribute to popular game franchises - Good opportunities for career growth - Global presence with diverse locations - Extra benefits and perks - Good equipment,"- Limited creative freedom and overly constrained processes hinder proactivity. - Communication challenges include language barriers, misinterpretations, and information sharing delays. - Required efforts to address diversity and inclusion. Poor team dynamics and Culture issues affecting marginalized groups."
803,1,No wonder why Ubisoft is in bad shape,Peis / player experience interaction specialist,"The office is beautiful, without being the best in the world Work/Life balance isn't too bad",Lot of dramas Really underpaid Toxic management - especially high management Below 40% of people are actually gamers
804,3,"Fun times, bad company",Software engineer (junior programmer),"Had really fun times on the projects I've worked on, made some great friends there, and work atmosphere was amazing! But not because company was cherishing it but because I had luck to work with amazing group of people! Still most fun and responsibility I had at work even on Junior level.",Company is not recognizing effort and progress being made out of passion. They will force you in lower ranks so they pay you less...
805,4,"lots to learn, but not lots to earn",Compliance specialist,"good people, good place to learn and connect","low salary, hybrid structure but project dependent"
806,3,my review,Manager,"big company, interesting projects, team","low salaries, management, culture, schedule"
807,4,Comparing to the market its a good incompany in terms of environment and possibilities to grow,Communications manager,Very good people; good environment; very flexible; respect personal life,Pay above the market; Very family-driven
808,4,It's ok,Concept artist,- job security - cool projects - teamwork with likeminded people,- cancelled games - Salary - Old processes (mainly BlueByte) that make No sense
809,4,Good organisation to start carrier,Game tester,Great culture to work in the initial phase of your carrier,Management not so good and not so supportive
810,5,Ubisoft Paris as one of the best studios of Ubi,Technical environment artist,- Fantastic colleagues - HR is always supportive together with the managers - open to different career developments - Incredibly talented and experienced people to learn from - Not afraid to risk - Great events - Interesting projects - WFH options,"- the studioâ€™s location is Not the best - the Salary is average, but HR are open to negotiate"
811,3,Good company,Recruiter,Well-known company with famous titles,"Low salaries in compare to other companies, layoffs,"
812,3,Greatplace for juniors,Concept artist,Very interesting projects on a creative standpoint.,Pay isn't very higi compared to international studios.
813,3,Laziness is king,Online programmer,"6 weeks of holidays, job safety, never need to go to the office","low salary, low growth opportunities, low motivation, takes forever to get things done, office is always dead, canâ€™t work remotely outside of Quebec"
814,4,"Great team, awesome work, low pay",User researcher,"The research team is great, some of the best people you can ever work with and the work is always exciting and a fun challenge",Slow progression and not the best salaries.
815,4,Great company. Talent people.,Product manager,The company lives and breaths gaming - and all teams are extremely passionate by the work they do everyday. You will have the chance to meet and work alongside a lot of amazing people.,Nothing that comes to my mind.
816,3,so and so,Hr specialist,team events & lot of fun,small salaries & benefits package
817,5,Great Culture,Compliance specialist,"Modern approaches, great working culture, and high-notch technologies.",Not clear communication between management and workers
818,4,Good place to learn,Senior game tester,Friendly environment Gym Membership Free Public transportation Card,The company doesn't respect senior testers and pushes them to leave.
819,5,Excellent,Game tester,Environment and hybrid work system,Nothing as i know of
820,5,Fun,Game tester,"Fun environment, biggest studio, awesome games",Very hard to get jobs
821,4,Good Start,Junior game tester,Good Work Life Balance and Fun Team,Low Pay for Entry Level Testing Job
822,5,Finance,Finance,"Amazing work culture, employee oriented",Management needs to be improved
823,4,good working environment,Devops engineer,"Good working environment, high Tech toolkit.",not always get an annual salary increase.
824,4,Best workplace,Player protection analyst,They actually care about their employees wellbeing and mental health,My only con is that itâ€™s not fully remote
825,3,"Amazing for early career, bad for mid and senior levels",Anonymous employee,Good career experience Nice atmosphere Generally friendly teammates,Low pay(!) Upper management are always behind the curve
826,4,Healthy work life balance,Software r&d engineer,For the most part company ensures a good work life balance. Job is fairly secured.,Pay is below industry standard.
827,5,Amazing Place to work,Compliance lead,"Work Life Balance, Lovely Team Mates",No cons I would love to work again
828,3,Good company to start a career,Jr. game tester,*Playing different games as a Tester was one of the Pros *Work Culture,No Work From Home in COVID
829,4,"Great culture, low compensation",Anonymous employee,"It feels that Ubisoft genuinely cares about people, they promote work-life balance and D&I, the leadership is very empathic and understanding. You really feel they try their best to make it a better company for everyone. On top of that, Ubisoftâ€™s own in-house tech and tools are very good.","The company strategy appears clear, but it is difficult to understand how exactly will we achieve these goals. Salaries and bonuses are quite low compared to competitors, and there will be next to no surprising happenings like (bigger) gifts, sudden bonuses and such."
830,5,Great company,Software developer,Great challenges and opportunities and fun,Heavy Workload soemtimes confusing tasks
831,4,Entry position customer Support,Customer support,Friendly people Free videogames Nice atmosphere Good entry in gaming or tech/IT industry Private health insurance Gym incentive,Salary does not change with inflation Hard to grow/less opportunities to get projects or higher positions
832,4,Good work environment bad pay scale,Junior game data analyst,Good work environment Good Work life balance Nice Opportunity of growth,Salary growth Lack of recognition
833,4,Good,Ui designer,"Good work environment, avantages, mood",Game design decision and vision
834,5,IT support,Erp specialist,Good work-life balance Good employer,Nothing Nothing Nothing Nothing Nothing
835,4,Good employer but not right now,Assistant communication,"Good vibe, they take care of the people and the final product is cool",With the current crisis it's less nice than usual
836,5,Good place,Junior qa tester,"Aaa games, gym, private health insurance","Low salary, raise once a year"
837,5,Cool place to work for a while,3d animator,Good social packages. Remote work. Cool colleagues.,Sometime the organisation of the job is not well structured.
838,3,Maybe ok,3d character artist,Great Work/life balance and nice benefits,Poor Salary & career development
839,5,"Great Team, cool projects",Audio director,At Ubisoft I have the chance to learn and share with top professionals in the game industry and work in great AAA titles well known and appreciated by players around the world.,Because is a big companies there are sometimes lots of bureaucracy and corporate suits could be more interested in the way they look rather than the games they allegedly make.
840,1,"Talks a big game, not worth it",Customer service agent,"Centralised work building, easy to get to","Literally everything else, stagnant pay, office politics, clueless management and awful HR"
841,4,Life,Associate lead,Work life balance maintained well. A lot of initiatives are take to educate employees.,In the name of Gender Equality and other ethics sometimes unworthy people get what they don't deserve
842,3,"Great for learning, not for earning",Qc team leader,"You're given commodities like gym, free bikes on the summer, meal tickets. You may have some team building opportunities (although they haven't happened since Covid). It's a great place for you to learn and grab experience to add to your curriculum. You may get salary raises, and bonuses according to your performance. The environment is generally quite laid-back (although it may depend on your area and people you work with).","As most significant companies, they will give uneven salaries to people depending on the intended salary you have provided when interviewed. As time passes, they will give you fewer bonuses and salary raises regardless if you have excellent performance, forcing you to hit a ceiling in your development. Eventually, they'll make you work more, while getting less bonuses. The company seems to be more mindful of the money being spent since covid and changing to the new office, so team building, gifts and bonuses and salary raises have been considerably lower."
843,4,Good work life balance,Studio production director,Good work life balance. Respect and benevolence in the company.,"Huge machine, huge inertia, leading to disconnection sometimes between strategy and what can be made for leaders, and feeling of having no impact for collaborators"
844,2,Ubisoft - not good,Anonymous employee,Triple A A A Game development,Poor pay Poor organisation French elite
845,3,Just ok right now,Game tester,"on time pay, frequent events",work culture is becoming more like IT
846,5,Amazing place to work at,Game economy designer,The work environment is the best. They recognize your accomplishments and they manage their people well.,Very restrictive into doing a hybrid work setup policy
847,5,Ubisoft,Communications specialist,"Great work-life balance Great work environment Cross-cultural experiences, and collaboration with diverse teams",Compensation Career opportunities decision-making processes can be slow or bureaucratic
848,3,All things are nice except salary range for QC,Junior game tester,STRICTLY NO CALLS ON WEEKENDS AND LEAVES,Very Mininmum Salaries are provided and hikes are very low
849,4,Back end,Back-end developer,Good place to work with nice people from around the world,"Terrible pay, quick tip don't work for game companies for money"
850,4,Good place to learn and grow,Ui designer,- There are a lot of talented colleagues you can learn from. - It is a good opportunity to experience how a big gaming company works in case you just started a job in the gaming industry,"- Compensation is still not competitive, even though it's a repeating problem every year - Communication is challenging, as it is too global (meaning too multiple locations to collaborate for one project) - Unsure about top management"
851,4,Great place to work - but not to have a career,Talent development coordinator,- great colleagues - interesting opportunities and fields of work - hybrid working model,- Sub-par compensation across the board - very Limited career opportunities
852,3,A company that used to be fun,Marketing project manager,"The office is amazing, with great amenities, they give you a lot of freedom in terms of work from home","More and more budget cuts affecting your everyday life : no more business travels, very little to no allocated budget for extra entertainment at the office"
853,3,sdsd,3d character artist,"Good Projects, good learning experience.",The payment is the losest among AAA game companies
854,4,Good,Tester,Nice culture And Good Environment,Project Deadline And Work Ethics
855,4,After 10+ years in the company,Creative director,Work/Life balance Lots of in-house support services Opportunities for internal mobilities across +40 studios,Too many decision makers in departments that are too disconnected from the realities of production
